subreddit,selftext,title
oceans,"I just got into the water on the coast of New smyrna Beach in florida and made my way out a little way and I kept feeling a stinging and poking sensation all over my legs and groin and butt. I took my trunks off in the water and noticed there were hundreds of little barbs stuck in the lining of my swim trunks and they were a little green in color but mostly clear. Anybody have an idea of what it could be? They were also 1/4"" to 1/2"" in length",Weird barbs
oceans,,Fish ID on the Gilis!
oceans,,Wreck diving SS HAMADA AT Abu Ghusun Wadi el Gemal MARSA ALAM
oceans,[deleted],Garbage Accumulation in the Pacific Ocean Over 20 Years
oceans,,Scariest Mythical Sea Monsters That Might Actually Exist
oceans,[removed],Good documentaries
oceans,,That's scary
oceans,,U.S. Position on Maritime Claims in the South China Sea - United States Department of State
oceans,,Boston Harbor - Sunset over Puget Sound
oceans,,Photo by Brian Skerry
oceans,,13 Most Poisonous Creatures In The Sea
oceans,,"Ahoy, Aivazovsky!"
oceans,"Hello everyone,   


First time posting here! Is there any data that is available for the CURRENT (2019 - 2020) fish/shellfish stock that is surrounding the Nova Scotia area?   


The U.S. has some great data available at [http://portal.midatlanticocean.org/visualize](http://portal.midatlanticocean.org/visualize) and I was hoping to find something similar to this.   


Survey data I would love to find:  


Groundfish;  
Lobster;  
Herring;  
Ocean Temperature &amp; Salinity.  


Thanks in advance!",Trying to find data for the Atlantic Ocean / Bay of Fundy
oceans,,A sub dedicated to Ocean Foraging. Post your finds here!
oceans,,One of Finlands Beautiful sunsets!
oceans,"Hi everyone! I need help and advices! Look for remote job in sound field of activity. I work in theatre. What should I read in the internet?  Whom to talk to look for a foreign job?
Thank you for advices",Job for Russian sound engineer
oceans,,Details 👀💙
oceans,"If the salt water is good for your skin, why do we wash it off?",Why do we take showers after the ocean
oceans,,"Green or Blue?,"
oceans,,Behind the dead-water phenomenon
oceans,,Just wanted to spread some beauty around the world
oceans,,The World's Largest Shark Has Thousands Of Teeth Surrounding Each Of Its Eyes
oceans,,Hello everyone! We are a recently launched nautical attire and home goods brand out of the sunny beaches of West Palm. We would absolutely love if you would take a look at our releases and give it a share! www.yellowshineshores.com @yellowshineshores
oceans,[deleted],Hello everyone! We are a recently launched nautical attire and home good brand out of the sunny beaches of West Palm. We would absolutely love if you would take a look at our releases and give it a share! www.yellowshineshores.com @yellowshineshores
oceans,,The terrifying telescope fish
oceans,woah!,hoolo
oceans,,This moment felt unreal.
oceans,,"The Ocean Uncut a 1 Hour edit of the Deep Blue showcasing some of the most stunning scenes, biggest sharks and most unusual wildlife the ocean has to offer. A Wet Slow TV edit designed to watch while you're working from home - hope you enjoy!"
oceans,,Have an eco friendly soap business - doing a giveaway if you sign this petition and send me a screenshot of your confirmation 💙🧜🏼‍♀️🐋 trying time use any platform I have to promote the earth. Instagram: solidaireorganics
oceans,[removed],Good documentaries
oceans,,Most Unexpected Underwater Archaeological Ever Found
oceans, [https://www.youtube.com/watch?v=Sa\_c3Sl7PBQ](https://www.youtube.com/watch?v=Sa_c3Sl7PBQ),"Save the Ocean after watching this video. Just simply add Oceanhero as your default browser search engine (with no ad-block) and every 5 searches will remove 1 piece of plastic from the ocean. 6,812,643 pieces of plastic have currently been removed and 291,210 pieces was removed just last week!"
oceans,,Free✨♥️
oceans,,"The Ocean Uncut a 1 Hour edit of the Deep Blue showcasing some of the most stunning scenes, biggest sharks and most unusual wildlife the ocean has to offer. A Wet Slow TV edit designed to watch while you're working from home - hope you enjoy!"
oceans,,Warming oceans deter more fish from spawning
oceans,,"The Ocean Uncut a 1 Hour edit of the Deep Blue showcasing some of the most stunning scenes, biggest sharks and most unusual wildlife the ocean has to offer. A Wet Slow TV edit designed to watch while you're working from home - hope you enjoy!"
oceans,,People save a whale who sits.up looking for help :)
oceans,,"Yes, subsurface drones crawling the ocean floor for untold riches of precious metals is safer for humans than working in mines, but don't kid yourself. This will most certainly have significant (if not catastrophic) ecological and environmental impacts."
oceans,,12 Favorite Beaches in America to Visit -- Summer 2020
oceans,,Colourful 🔥
oceans,,Florida sky line.
oceans,,Livestream catches sea bird pooping all over marine research buoy 🤣
oceans,,"64,000 Green Sea Turtles Filmed At Once Off Coast of Raine Island, Australia"
oceans,,A New Study in California Uses Drones And Underwater Robots to Capture Close Encounters Between Great White Sharks And Beachgoers
oceans,,Little Black Sands Beach. Lost Coast Trail in the Kings Range National Conservation Area in Humboldt County is the longest beach wilderness trail in the US. Much of the trail is beach hiking. Carry a tide chart. [BLM] (5738 x 3825)
oceans,,What do you think about this shades of blue? 💙
oceans,,"Newly Discovered Algae Species Infesting NW Hawaiian Waters: Researchers discovered an aggressive, fast-growing species of algae in Papahānaumokuākea Marine National Monument, and believe it may be a major threat to coral reefs."
oceans,,"2020-06-30 i,m enjoying summer with my baby kid's reyes and my mother,an..."
oceans,,Long Island Astrologer Astrology With Betty Providing Astrology &amp;amp; Tarot Readings
oceans,,4k Footage of Challenger Deep
oceans,[deleted],4k Footage of Challenger Deep
oceans,,Red Sea vibes - Roten Meer vibes - Tauchen am Shams Alam Hausriff
oceans,,"In the seawater, chemical reactions occur with carbon dioxide that lowers seawater pH, reduces carbonate concentration, and reduces saturation states of biologically important calcium carbonate materials."
oceans,,Relaxtion mood
oceans,,Why we need sharks: the true nature of the ocean's 'monstrous villains' | Environment
oceans,,Solomon Islands. Tour around the world. Charming places.
oceans,[click here](https://youtu.be/2rcN3TGCr-g),Relaxing ocean waves
oceans,,Meet the Most Loudest Sea Creatures on Earth that will make you DEAF!
oceans,,Most Terrifying Prehistoric Sea Monsters That Ever Lived
oceans,,"Beach Cleanups Prove Popular And Purposeful During Pandemic: People want to help or just stretch their legs, and groups are organizing events with safety guidelines in mind."
oceans,,Nature💙
oceans,,"Concerning issue of ocean pollution and over tourism in Gokarna, India"
oceans,[Click Here](https://youtu.be/2rcN3TGCr-g),Relaxing Ocean waves
oceans,,מכר נחלה | קניית נחלה - עורך דין לעסקת רכישת נחלה -גד שטילמן
oceans,,Scary sounds recorded underwater
oceans,,Headless Chicken Monster: Bizarre Sea Cucumber Filmed in Deep Sea
oceans,,Many of these found on PNW beach in Puget Sound. What is it?
oceans,,These Worm-Like Amphibians May Have Venomous Saliva
oceans,,This sailor is racing around the world to gather data on microplastics | Living
oceans,"i live in washington state, so no sharks. im thinking it might have been a seal but im not sure. thank you!

https://imgur.com/a/n0EU4Dg",anyone know what ate this dogfish?
oceans,,Scientists Have Confirmed The Extinction Of The Smooth Handfish
oceans,,"The red-lipped batfish is a fish of unusual morphology found around the Galapagos Islands and off Peru at depths of 3 to 76 m (10 to 249 ft). Red-lipped batfish are closely related to rosy-lipped batfish (Ogcocephalus porrectus), which are found near Cocos Island off the Pacific coast of Costa Rica."
oceans,,doing Fish ID while diving the Gilis! hope you enjoy!
oceans,,Perfect for my little Marina... she want safe the world!
oceans,,"Every year hundreds of Leopard/ Zebra Sharks migrate to one of my local dive sites. Equipped with a gummy mouth, these sharks are as unique as they are oddly beautiful. Hope you enjoy this 2min Mini Documentary Film I created on these stunning sharks"
oceans,,Storm near Bermuda 🇧🇲 c.2018
oceans,,Does anyone know what is it called? Its like from a Scifi movie
oceans,,10 Famous Prehistoric Animals That Aren't Actually Dinosaurs
oceans,,Cool boats
oceans,,Got this masterpiece one!
oceans,,Ocean warming spurs marine life to rapid migration
oceans,,"Every year hundreds of Leopard/ Zebra Sharks migrate to one of my local dive sites. Equipped with a gummy mouth, these sharks are as unique as they are oddly beautiful. Hope you enjoy this 2min Mini Documentary Film I created on these stunning animals"
oceans,,Whale Sharks Have Teeth On Their Eyes
oceans,,"[OC] cheers! Tulum, Mexico Febuary 2020"
oceans,,Ocean plants produce 50%+ of the world's oxygen
oceans,"Wasn’t sure where to ask this, so if this isn’t a good place please let me know where I should post. I am looking for some new t shirts and I’d love to get some that promote the health of our oceans. Are there any particular causes or websites any of you would recommend buying from? Please comment below.",Ocean friendly clothes?
oceans,,Beach in New Jersey getting reclaimed by the ocean.
oceans,,1 Hour of Caribbean Blue 😌💗🏝
oceans,,"11 Utterly Odd Facts About Crinoids, Sea Creatures That Are Basically Aliens"
oceans,,Unbelievable Facts About The Giant Squid
oceans,,Ocean waves
oceans,,The best ocean waves
oceans,,How a Blobfish Looks with and without Extreme Water Pressure. Learn more in the comments
oceans,,The waves of the ocean. Calmly splitting seconds.
oceans,,Lions Mane Jellyfish in Puget Sound
oceans,,Saving The Oceans With Advanced Transportation Technologies
oceans,,Dr. Chelle Gentemann of the Farallon Institute talking about using AI and ML to do (ocean) science during the AWS Public Sector Conference
oceans,,An adorable monk seal pup recently born on Oahu is showing excellent signs of growth. A monk seal named “PO5” was born about 3 and a half weeks ago. It was the 5th known monk seal birth on Oahu this year.
oceans,,World's Most Intriguing Transparent Animals
oceans,,I've made a little lock-down video (with a few friends helping with the reading) of my picture book about Ocean trash :) I hope it's ok if I post it here!
oceans,,Dream - Oceanside Candle Light | Calm and Peaceful Sea Waves with Soothing Romantic Music HD
oceans,,"2020-06-30 i,m enjoying summer with my baby kid's reyes and my mother,an..."
oceans,,B.C. First Nations leaders want immediate end to open-net salmon farms
oceans,,"I love drawing, the ocean, and the creatures that live in it. Here's a sticker I drew of one of my favorite denizens of the deep the barracuda"
oceans,,Sunset state of mind.🌅
oceans,,"What lays beneath the waves of the ocean is unchartered territory. It is curious to think we have ventured on the Moon and, yet, we don't know much about our own planet. We cannot do anything else but wonder in awe at those mysteries that are still hidden to us."
oceans,,"Dugong , Seekuh Marsa Alam Egypt Red Sea Film video Kapustňák"
oceans,,Meet the animal that never dies
oceans,,Rarest Snake That Still Exist Around The World
oceans,,Tuesday Relaxtion mood
oceans,,Interpretation of dreams | RIVER
oceans,,3D-Modeling is Changing How We See Deep Sea Corals
oceans,,Helena Cove Hawaii Slow Motion Waves
oceans,,Calming Ocean Sounds
oceans,,Giant Squid may be hugely intelligent
oceans,,Magnetic Island. Tour around the world. Charming places.
oceans,,"It’s great to see some good news, especially news like this 🙌"
oceans,,Pink or Blue?
oceans,,Unbelievable Underwater Ruins Of Lost Civilizations
oceans,"Here is a book review on a (relatively) new book on the history of oceans in world history: *Vast Expanses: A History of the Oceans,* by  Helen M. Rozwadowski 

Check it out!

 [https://www.h-net.org/reviews/showpdf.php?id=54780](https://www.h-net.org/reviews/showpdf.php?id=54780)",Book on the history of oceans
oceans,,"Two new genera and four new species of giant, single-celled xenophyophores (protozoans belonging to a group called the foraminifera) were discovered in the deep Pacific Ocean"
oceans,,"If you are a fan of squids, or any sea life in fact. Join this server we have pretty active people talking. 70 members at the moment. Mostly a joke server but serious discussion is allowed."
oceans,,G R E E N ✨💚
oceans,,"Fish ID while diving Trawangan Slope on the Gilis, Indonesia"
oceans,,Interpretation of dreams | SEA
oceans,,10 Most Horrifying Sea Monsters To Ever Terrorize The Ocean
oceans,,Join Team Planet in removing plastic from our Oceans - sign the petition!
oceans,,I was at the beach today and something electrocuted me on my shoulder first and i saw the creature barely but looked like a jellyfish my shoulder is ok but then something electrocuted my hand after a while and I don’t know what. Do u guys know what this is?
oceans,,Sunlight dancing through clear blue waters 💎💦
oceans,,Our earth is beautiful we need to stop treating it so badly. What your opinion on this?
oceans,,"Two new genera and four new species of giant, single-celled xenophyophores (protozoans belonging to a group called the Foraminifera) were discovered in the deep Pacific Ocean during a joint project between scientists."
oceans,,2020-06-14 thank you to sure health canada for i and my baby kids reyes ...
oceans,,"Best Big Barrels in Slow Motion (Bodyboarding) | Sandy Beach, Oahu, Hawa..."
oceans,,10 Rare Creatures That Are Almost Too Weird to Actually Exist
oceans,"Hey y'all, I live near the ocean and go out paddling, swimming, and snorkeling regularly, but other than my gut feeling and eyeballing it, do you know of any ways that I can get temperature, tide, and current data (or anything else) remotely so I can make better decisions about which activity to pursue at which time? I know there's apps and websites that have some of that data but it doesn't seem holistic or accessible. Thanks!",Apps/Data Feeds for Ocean Data
oceans,,Thursday 💙
oceans,,"This Ship Snagged 206,000 Pounds Of Trash From Ocean: The Kwai collected more than twice as much garbage as it did on last year’s voyage."
oceans,,"Biarritz, France"
oceans,,Hard Sea
oceans,,"When I first saw this picture I was in shock. We have to rethink our role on this planet. We should not be the conquerors of nature, but the protectors of its pristine beauty. I want to never forget love and respect make the world go round and round."
oceans,,"🏄🏾‍♂️A Quiet Evening On The Beach Of Scheveningen, The Hague. 4K Video |..."
oceans,,"After finding more reefs, the Baltic Sea tunnel construction has to be reassessed"
oceans,,"If humans like the sound of nature so much, why they destroy it?"
oceans,,Importing Premium Cashew From Vietnam : A Trade Leader | Fruitful Kitchen
oceans,"I’m a good swimmer, know when and how to get out of bad situations. But my main concern are man’ O’wars and sharks.",Anyone here know how if there is any risk other than jellyfish and rip currents if I swim to the first sandbar (about 150yds) in the Gulf of Mexico our near ft Pickens FL?
oceans,,Experience the underwater world through the eyes of the diver
oceans,,10 Horrifying Prehistoric Creatures That Lived 500 Million Years Ago
oceans,,"Introducing the DeeperBlue Podcast and ""Blue Planet"" &amp; “Our Planet” underwater filmmaker Hugh Pearson"
oceans,,"I found this video of huge waves, it is like ten seconds into the video"
oceans,"We are 4 highschool students who have been working on a underwater waste collection system which utilizes two machine learning models to achieve full autonomy.

We have already fully developed the software but to ensure our project continues and makes a change, we need **YOUR** help. I'd like to ask you to vote for us either on the take action page of our website ( [http://aquation.ml/help/](http://aquation.ml/help/) ) and/or on the official voting page ([https://app.moonshotpirates.com/bootcamps/previews/srZ7X8Z8oIVU0FsG/voting/Jd7KlVZIdGEz2mh8](https://app.moonshotpirates.com/bootcamps/previews/srZ7X8Z8oIVU0FsG/voting/Jd7KlVZIdGEz2mh8)).

Note: You can submit a vote on the official platform once a day, but we have a function on our website to automate this process the whole week. Using our website, you can have a 7-times bigger impact!

Please click on the verification link sent to you after voting for us, please also check the spam and promotions inbox for the email.

\-----------------------------------------------------------------------------------

ASWAP (Autonomous Sub-aquatic Waste Acquiring and Pre-processing) unit:

It is well known that underwater waste has a **massive destructive** effect on life **above and below** water.

Not only does it directly **harm and kill** living organisms underwater but it also influences the rest of the ecosystem by reducing the ocean plants (which contribute 50-85% of the O2 production on earth) level by approximately **40% since the 80s**.

The ASWAP unit can collect underwater waste and sort them **automatically** using a weakly supervised waste detection model and a waste classification model.

By sending a drone underwater to collect waste, we are removing the need of a trained worker who would ordinarily have to face the **dangers of the depths** to accomplish the same tasks.

One of the greatest issues faced in the ocean cleanup projects today is the **handling of waste** after it is collected. We use **advanced** classification models (92+% accuracy) to sort garbage in our docking stations so that it can be recycled and resold.

Our solution can **safely and efficiently** remove waste debris from underwater areas which may be less accessible to humans, and thus protect the ecosystem.

&amp;#x200B;

Vote for us and contribute to the fight against marine warming!:  [http://aquation.ml/help/](http://aquation.ml/help/)

https://reddit.com/link/heguo4/video/h3to628kio651/player",Fully Autonomous Underwater Waste Collection System (ASWAP by Team Aquation)
oceans,,Inside ocean
oceans,,Taken somewhere in the middle of the Atlantic when I was deployed on a ship last year
oceans,,Pirates
oceans,,Amazing Wild Atlantic Salmon &amp; Walleye Fish Harvesting ! Automated Egg Fertilization Process.
oceans,,Good morning ✨
oceans,,Sleep Sounds #1 Sea &amp; Wave 8h
oceans,,Can't imagine they actually exist in the world before
oceans,,Can't imagine they actually exist in the world before
oceans,,Weirdest Deep Sea Creatures That Actually Exist
oceans,If there was a boundless ocean reaching as far as could possibly being imagined with unlimited water. Say it had two giant mountains. Would that ocean ever taste Salty?,Hypothetical question
oceans,,Map of world's uncharted ocean beds takes shape despite crisis
oceans,,I love watching skyline from accommodation.
oceans,,Nearly a fifth of world's ocean floor now mapped
oceans,,"Prince Rupert, BC, Canada"
oceans,,Art show celebrating the ocean warns of washed up plastic trash
oceans,,Giant Egg Discovered In Antarctica Belonged To Marine Reptile
oceans,,Orca predation on South American Sea Lion Pup— bucket list ?
oceans,,Pomodoro Technique Tropical Ocean Video ! 30 mins x 10 min break :)
oceans,,"Seaport Village, San Diego, CA, USA"
oceans,,Fish ID while diving Turtle Heaven on Gili Trawangan
oceans,,2020-06-14 thank you to sure health canada for i and my baby kids reyes ...
oceans,"So, I was in SW Louisiana on vacay this week. A man in a shop we stopped at told us to go to a certain beach because the ocean current there causes sharks to become confuse and perish and that lots of shark bones and teeth wash up there. I’ve looked and googles a million things and can find NOTHING. He sounded very knowledgeable but I’ve never heard of this and it’s driving me crazy.",Do sharks become confused and perish?
oceans,,S E A 💙
oceans,,"It's not cool, we are guest in the ocean please respect the rules of the animals.. at the end it's very dangerous"
oceans,"So I recently was watching a video about underwater acoustics and they mentioned how they have hundreds of sound samples with unexplained causes. A few of which originates from the region west of Peru. This area from what I remember is like a ocean desert. No landmass for miles, the wind and currents there make it almost standing water. Yet according to these sounds there is something there. Has anyone tried to set up a network of hydrophones to try and triangulate the origins of these strange sounds?",Southern Pacific underwater acoustics.
oceans,,Most Dangerous Sea Creatures In The World
oceans,,A group of sailfish hunting a bait ball with Abzu ost
oceans,,Foam on the sea - 2020
oceans,,"🦀Island in Destin, FL ✨✨✨✨✨ (please feel free to follow my photos on IG @Megnwetzel)"
oceans,,I made this little fat seal keychain that I thought this sub might appreciate ❤️
oceans,,"Beautiful evening off the St. Petersburg, FL coast looking West across the Gulf of Mexico #gulf #florida"
oceans,,I hope you like the video . Interesting Scuba Diving video in Red Sea
oceans,,Interpretation of dreams | SEA
oceans,,“No One Will Save The Planet For Us” A Disturbing Video Showing Marine Litter
oceans,,Glowing Blue💙
oceans,,"More fish and larger predators, such as ulua, omilu and reef sharks, have returned to the waters off Molokini in the few months that commercial boat traffic has been halted due to COVID-19 emergency orders, said a researcher who was part of a survey team of the preserve."
oceans,,🐟
oceans,,Breathtaking Journey to the Deepest Point of the Ocean!
oceans,,Relaxing Ocean Sounds / Amazing 4K Drone Footage
oceans,,The Shark Club
oceans,,Ancient Cambrian Shrimp With Dozens Of Dagger Legs Looked Unlike Anything Alive Today
oceans,,The race is on to grow crops in the sea and feed millions of people
oceans,,2020-06-14 thank you to sure health canada for i and my baby kids reyes ...
oceans,,Relaxtion Time 💙
oceans,,Abandoned Lobster boat Nova Scotia
oceans,,s t o p s c r o l l i n g d o w n 😴😴😴😴 r e l a x a n d g o t o s l e e p
oceans,,Kelp forest
oceans,,"Saildrone to Perform Annual Alaska Pollock Survey Amid COVID-19 Lockdown... “Extraordinary times require extraordinary measures,” said Alex De Robertis, a fisheries biologist at NOAA Fisheries."
oceans,,Top Ten Facts About The Ocean in 2020
oceans,,Tuesday Morning 💙
oceans,,My wife made this cake in honor of world sea turtle day. Credit goes to Liz Marek of sugargeekshow.com for the instructions
oceans,,Made this for blooming octopus in sharpie and wanted to share! What do you think? What should I do next?
oceans,,Can someone tell me what this is?? Found on pacific Beach!
oceans,,Who Is Really The Virus? Soon There Will Be More Masks Than Jellyfish In The Ocean (IMAGES)
oceans,,What is SeaLifeBase and how it came to be
oceans,,PhiPhi Island💙
oceans,,"Sand Dollars Making BIG comeback in Bonita Springs, Florida! I have not seen levels like this since the 80s! Covid took a lot of pressure off of our local ecosystems"
oceans,,This tiny mass of land emerged after Tsunami in 2004. It appears and disappears with tide but it is a very intriguing spot.
oceans,,2020-06-14 thank you to sure health canada for i and my baby kids reyes ...
oceans,,"Hi! 😊😊Thank you for listening to this nature video, we hope you liked it! Want to hear more nature sounds? Subscribe now by click https://bit.ly/2WSbrPk and leave a comment below 'I SUBSCRIBE'."
oceans,,I love the ocean and the secrets it keeps below. Made this geometrical sharpie ship wreck design and wanted to share! What do you all think?
oceans,,"Dream come true today with some Great Whites. Off of Stewart Island, NZ"
oceans,,the fact that jellyfish have survived for 650 million years despite not having brains gives hope to many people ... lol
oceans,"I intend to share knowledge on oceans and earth, such as to create awareness and create a basic understanding on the science behind various earth processes.

[View Poll](https://www.reddit.com/poll/h8r4j8)",Will you appreciate a dedicated youtube channel on Earth and Ocean Sciences?
oceans,,"New discovery, i think everyone wants to know about this"
oceans,,The Smallest Lethal Creatures On The Planet
oceans,,RELAX JELLYFISH AQUARIUM: Relaxing Screensaver Ocean
oceans,,My local dive site is home to one of the worlds largest populations of Weedy Sea Dragons. These animals are endemic to the southern waters of Australia and are incredibly beautiful. I hope you enjoy this short reel we shot earlier this year!
oceans,,"Corals: Living Rainforests of the Sea ~ Hanau ka ‘Uku-ko‘ako‘a, hanau kana, he ‘Ako‘ako‘a, puka"
oceans,[deleted],My local dive site is home to one of the worlds largest populations of Weedy Sea Dragons. These animals are endemic to the southern waters of Australia and are incredibly beautiful. I hope you enjoy this short reel we shot earlier this year!
oceans,,Amazing coast of Pico Island
oceans,,Longest Sea Creatures Ever Recorded
oceans,,Perfect Saturday morning 💙
oceans,,Perfect Saturday morning 💙
oceans,,Did some fish ID while diving Melissa's Garden - Raja Ampat Indonesia
oceans,,"Moturakau, The Cook Islands"
oceans,,This Is What Scientists Think The Loch Ness Monster Actually Is
oceans,,What are some interesting mysteries of the ocean?
oceans,,We Are a Walking Ocean
oceans,,Baby Blue 💙
oceans,,The Surprising Diet Of The Dreaded White Shark
oceans,,Newly discovered super groups of humpback whales mysteriously appear off the coast of south africa
