subreddit,selftext,title
oceans,,"happy birthday to me,happy christmas eve,happy new years eve,i and my ki..."
oceans,,The Portuguese Man O' War: Nature's Deadly Warships (NOT a jellyfish!)
oceans,,World leaders are waking up to the ocean’s role in a healthy planet
oceans,,Engineers from Stanford improve the mapping of ocean floors by combining light and sound modalities via the photoacoustic airborne sonar system to produce high-quality 3D images of the ocean floor.
oceans,,Great Barrier Reef outlook 'critical' as climate change called number one threat to world heritage | Great Barrier Reef
oceans,,Watch me rant about the ocean
oceans,,Calming Piano Music with Ocean Waves
oceans,,The Storegga tsunami and the end of Doggerland
oceans,,Researchers from (NOAA) have identified a new species of ctenophore (Duobrachium sparksae) using high-resolution footage of a deep-sea drone for the first time .
oceans,,"Because it has sharp teeth, researchers believe the worm is a carnivore, and that it can possibly extend its jaws to catch its prey. To make things even weirder, the part that looks like its head is actually its throat."
oceans,,"Barracuda - A large fish with aggressive and predatory behavior. Like sharks, some species of barracuda are considered dangerous to swimmers. Many recorded attacks on humans seem to be related to flashing jewelry and even diving knives."
oceans,,"The possibly first scientific estimate of how much microplastic currently resides in Earth's seafloor is created: ~14 M tons – ca. double the scientists' estimate based on earlier data and 1-1.7 times the amount of plastic thought–per Jambeck et al., 2015–to annually enter the oceans"
oceans,,"Not sure if this is interesting to you guys, but at 7pm CET tonight on Facebook Live, TBA21–Academy is doing a digital concert of freq_wave, an electronic mixer that makes music out of recorded sounds from the oceans. i.e sound of whales and coral hanging out is turned into music"
oceans,,"Scientists Confirm Entirely New Species of Gelatinous Blob From The Deep, Dark Sea"
oceans,,Interesting facts about whales that are often forgotten by people
oceans,,Got those feels again
oceans,,"Times Awash, Wild Atlantic Way, Ireland"
oceans,,The Ocean and Your Brain
oceans,,Fukushima’s Radioactive Wastewater Dilemma | Hakai Magazine
oceans,,Happy Elephant
oceans,,Sun rise again and we can start again and again
oceans,,Help with Theoretical Ocean Identification
oceans,,Critically endangered Grey Nurse Shark populations are scattered across Australia. Seal Rocks in Forster is lucky enough to have a permanent population of 15-20 year round and up to 200+ in peak season. Better yet it's just a short walk off the beach to swim there! Hope you enjoy this epic 1min film
oceans,,O C E A N 💙
oceans,,Three granite sisters watching the sunset
oceans,,"Caecilians are amphibians like salamanders and frogs, but they are often mistaken for earthworms or snakes. They spend most of their lives underground, some in shallow streams, and are rarely seen by humans. There are nearly 200 species of caecilians, ranging from the 4 inches to 5 feet long."
oceans,,The Ambience of the Titanic
oceans,,Underwater creatures with regenerative ability..
oceans,,The island is located in the South Atlantic Ocean: 1600 miles away from South Africa and 1100 miles from Antarctica.
oceans,,Blue Details ✨💙
oceans,,Beach combing in southeast Alaska
oceans,,"happy birthday to me,happy christmas eve,happy new years eve,i and my ki..."
oceans,,"Unexpected ancient lost city of Neapolis found underwater. The researchers found Roman street signs and monuments on the ocean floor. In addition, they also found around 100 tanks that were used in the production of garum."
oceans,,Why Are Sharks Afraid Of Dolphins?
oceans,,"Ocean Waves 4K Ocean Waves Sounds for Study, Meditation or Relaxation 2020"
oceans,,"To Save the Ocean We Need Less Talk, More Action"
oceans,,Series of short timelapse of the Ocean and Sea combined into one clip.
oceans,,They Discovered A New Species In the Deep Sea Yesterday
oceans,,A video on how NASA monitors sea level rise!
oceans,,What Sort of Planet is the Earth?
oceans,,Diving in North Carolina
oceans,,"Thought These Were Some Cool Facts About the Ocean, and a Good Message Too"
oceans,,Love or sea?
oceans,,When you're in a bad mood go there and feel the fresh air with sea
oceans,,Wobbegong Shark - Weirdest Ambush Predators With A Shaggy Beard
oceans,,"negative tide sunset scene of rocky reef, background ambiance with surfers and a lofi soundtrack"
oceans,,Scientist at work: I'm a geologist who's dived dozens of times to explore submarine volcanoes
oceans,[removed],Has there really been sightings of unknown submerged objects?
oceans,,Hey people! Please support the cause and make the ocean beautiful! Share the cause with friends and on social media and tell them to sign the petition!
oceans,,Love in the air✨
oceans,,Wonderful encounter with those gentle giants! Even got a visit from a pod of dolphins too. put son interesting facts about Whale sharks in the video. enjoy.
oceans,,[urgent]what are the basic textbooks to learn the key concepts of oceanography?
oceans,,"Behold, the marine army. I drew these as a joke, and thought they would be funny"
oceans,"Hello everyone! My name is Jackson and this past week I started my own apparel company. J. Louis is a socially and environmentally conscious business focused on starting conversation and donating! With every purchase of a t-shirt, $2 is donated to a previously selected non-profit organization. The four shirts focus on education, trees, gorillas and the ocean, cleaning out the plastic, saving the aquatic animals and preserving its beauty. I am currently a junior in college, and my goal is to bring people together because if we work as one, we can change the world! Check out my website [jlouisapparel.com](https://jlouisappare.com) and help me spread the word! Thank you!",Check out my new apparel company focused on cleaning the ocean!
oceans,,Feel the details
oceans,,"The Ocean around Forster is teaming with life! From scuba diving and free diving with Grey Nurse Sharks and Turtles, to epic beaches and awesome Whale Watching, it’s an ocean lovers dream. Hope you enjoy short film"
oceans,,Nice Ocean Wave
oceans,,Only 72 Orcas in this Population | The Navy is Putting them in Danger
oceans,,"Desalination, is future of fresh water?"
oceans,,Size Comparison: Prehistoric Sea Creatures
oceans,,"Tomales Bay, Ca Crab Trap Soak 11/15/2020"
oceans,,Perfect reflection 💎
oceans,,It's my fav view
oceans,,"Abalone - The large marine gastropod mollusks. They have a single broad flattened shell with a row of holes on one side of their shell, which is lined with an iridescent nacre. The flesh of abalones is widely considered to be a desirable food, and is consumed raw or cooked by a variety of cultures."
oceans,How deep is the continental shelf typically and how deep is the deepest location of any continental shelf?,Depth of the Continental Shelf
oceans,,"happy birthday to me,happy christmas eve,happy new years eve,i and my ki..."
oceans,,"NEW relaxation sound 2020, new relaxation music 2020, new soothing sound 2020, new calm music 2020"
oceans,,"New relaxation sea waves sound with music 2020, New relaxation ocean waves sound with music 2020"
oceans,,"NEW relaxation sound 2020, new relaxation music 2020, new soothing sound 2020, new calm music 2020"
oceans,,"NEW relaxation sea waves sound with music 2020, new relaxation ocean waves sound with music 2020"
oceans,,"Ocean Wave Lightbulb, what do you think?"
oceans,,Sleep under the ocean
oceans,,Star Fish is my Favorite
oceans,,Sharks Get Lonely Too: Why We Are Finding More Sharks Away From Their Natural Habitats
oceans,,"Thanks, I hate the ocean."
oceans,,Can we run?
oceans,,Your way to heaven
oceans,,"When trilobites first emerged at the beginning of the Cambrian period (541 million to 485 million years ago), they were extremely diverse, potentially because there weren't that many competitors."
oceans,,Deep horizons: Canada's underwater habitat program and vertical dimensions of marine sovereignty
oceans,,Early Twentieth-Century Ocean Science Diplomacy
oceans,,Scientific imaginaries and science diplomacy: The case of ocean exploitation
oceans,,"6 Enormous Facts About Sperm Whales, Gigantic Creatures of the Sea"
oceans,,7 Horrible Things That Plastic Causes In The Ocean
oceans,,What a wonderful sunset 💛
oceans,,Pink sunset 😍
oceans,,"The giant oceanic manta ray, also known as giant manta ray, is the largest type of ray in the world. They can reach a considerable size, with an average width of 4-5 meters and sometimes up to 7 meters"
oceans,,What wonderful things one can find while snorkeling in front of your Bungalow on Derawan Island. 🐟🐡
oceans,,A beautiful mutant four legged starfish. Super unique and special.
oceans,,Best Drinking Water
oceans,,What Does Joe Biden Mean For Our Oceans?
oceans,,A cold fall day Skimboarding in laguna beach
oceans,,"200 years ago, people discovered Antarctica – and promptly began profiting by slaughtering some of its animals to near extinction"
oceans,,"A white spirit spotted off the coast of Australia - ""Migaloo"""
oceans,,Why a COVID-19 vaccine could further imperil deep-sea sharks
oceans,,Perfect sunset 💛
oceans,,Star Fish ✨
oceans,,why is ocean still unexplored ?
oceans,,A cold fall day Skimboarding in laguna beach
oceans,,"200 years ago, people discovered Antarctica – and promptly began profiting by slaughtering some of its animals to near extinction"
oceans,,This Video About a Rare Deepsea Squid Sighting
oceans,,London or scotland oceans?!
oceans,,I made a sticker of this turtle I painted
oceans,,What if the poles of earth was flipped ?
oceans,,This insane view in the ocean near Scotland❤️😍
oceans,,This ocean reminded me how insignificant we are and how this huge log tree washed up in the storm
oceans,,Magnapinna Footage - Deep Sea Squid Near Australia For The First Time
oceans,,Good companies to support the protection of our oceans?? Drop them below ⬇️⬇️⬇️
oceans,,Perfect sunset shot
oceans,,"I made this piece, if anyone is interested, of a terrifyingly beautiful oceanic scene. “A Day at Nauset” and my socials are @kaitlynlijoiartist"
oceans,"Hey all, excited to share that I've started a new, ocean-focused community called [Ocean Oracles](https://civildialogues.org/c/ocean-oracles/22/l/dialogs) on [CivilDialogues.org](https://civildialogues.org/), a site designed to foster conversation on interesting and important topics.

I'd encourage y'all to check it out, sign up for the site (only verified people allowed to post &amp; comment), and add your questions and answers to the ocean-focused topics you see.

Thank you in advance! :)",Introducing Ocean Oracles -- a new community for ocean dialogue
oceans,,Epic Trip To The Upper Peninsula
oceans,,Slowmotion flying Gulls-Natural scene- 1080p
oceans,,"Sea lamprey is a parasitic fish that lack scales and gill covers. Sea lampreys have been invading the Great Lakes in the 1830s through the Welland Canal. According to the survey, one lamprey kills about 40 pounds of fish every year."
oceans,,"Climate Change, Disease, and Pollution from Land Are Killing US Coral Reefs"
oceans,[removed],looking for information on “The Wall” St Croix USA
oceans,,Seashull like heaven
oceans,,Ghost nets are the invisible threat in the world's oceans - one million tons end up in the oceans every year
oceans,,"ITAP on the Hobbit Trail in Florence, OR USA"
oceans," Check out our latest interview with Mark Caney; Chairman of Project AWARE, a registered nonprofit organization working with volunteer scuba divers. 

\-----

Mark Caney is an accomplished author who has also had an illustrious career within the various diving industries.

He was the Vice President of Training &amp; Customer Services with PADI, three times President of the European Underwater Federation, twice President of the Rebreather Training Council, and continues to hold senior positions in the World Recreational Scuba Training Council.

He has also recently contributed and chaired the creation of the new worldwide diving medical screening system that you will see and fill out when you begin a diving course!

Check out how he began his diving career, his experience as a marine mammal medic, and where the inspiration came from for his highly-acclaimed novel, Dolphin Way: Rise of the Guardians.

https://www.downtoscuba.com/mark-caney-leading-expert-in-dive-training/",Q&amp;A with Mark Caney; Chairman of Project AWARE &amp; Leading Dive Training Expert
oceans,,Dance in the air
oceans,,Morning Harbor Fog
oceans,,Before Sunset
oceans,,Sun kiss 💛💙
oceans,,"Madeira, Portugal - [4K] Relaxing Ocean Waves Sounds for Sleep, Study - Praia do Sol. Ponta do Sol"
oceans,,Relaxing Videos | Beach Meditation | Sleep to Crashing Waves | Sleep Sounds [Oceans]
oceans,,เลขเด็ด งวดนี้ 16 พฤศจิกายน 2563 เลขดัง ทั่วไทย ครบทุกสำนัก
oceans,,Ocean like an Art💙
oceans,,Now this is one special place! Imagine stepping out of your bungalow over the water and immediately have 10 or so of these huge green turtles around you!
oceans,,How I got into skimboarding | 2012
oceans,,Ocean bath mat(:
oceans,,I’ve been picking up trash on my local beach these last few months! I started an Instagram account in the hopes of motivating people to do the same! Here’s a video compilation of all the bags I collected on a mile stretch of beach.
oceans,,Free your mind
oceans,,Feel the world by this shot
oceans,,"Decided to share this here, my fiancée and I went out one last time to clean the beaches of Europe's largest passenger port before total lockdown"
oceans,,My weekend is better than yours
oceans,,NASA Visualization of Global Barotropic Ocean Tides
oceans,,Feel the Freedom
oceans,,Great White Shark - The Impressive Biological Adaptation Of Apex Predators
oceans,,2020-09-24 my baby kids back again at their school so i and reyes and my...
oceans,,Marine Myths: Could a Megalodon Still Lurk In Our Oceans?!
oceans,,Striped Marlin and Bluefin Tuna Artwork
oceans,,Deep deep sea trivia quiz!
oceans,,Port Rashid - United Arab Emirates
oceans,,"Madeira, Portugal - [4K] Relaxing Ocean Waves Sounds for Sleep, Study - Praia do Sol. Ponta do Sol"
oceans,,Skimboarding a wave In California
oceans,,What are these walls called and what is their purpose? (Tampa bay)
oceans,,Lovely day in the Irish sea
oceans,,"Tristan da Cunha colloquially Tristan, is a remote group of volcanic islands in the south Atlantic Ocean. It is the most remote inhabited archipelago in the world"
oceans,,Perfect Shades of Blue 💙
oceans,,Most Extraordinary Giant Gippsland Earthworm
oceans,,Evolution of Life: When Megalodon Reclaimed the Oceans (Neocene)
oceans,,"Video I made in 4k HDR at Stillwater Cove, Ca. I hope you enjoy and that it brings you peace!"
oceans,[https://www.youtube.com/watch?v=WPyhr6TvTiM](https://www.youtube.com/watch?v=WPyhr6TvTiM),"Video I made in 4k HDR of Stillwater Cove, Ca. I hope it brings you peace and that you enjoy!"
oceans,,"Animation I made on convergent evolution, comparing dolphins and the now extinct stenopterygius. Thanks to an especially well preserved specimen found in 2018, we now know that stenopterygius and other related ichthyosaurs had a lot more in common with dolphins than we previously thought. Enjoy!"
oceans,,Blue details make our hearts melt
oceans,,I just found out Salmon sharks are a thing and they are so cute!
oceans,,"Glen Burnie, MD Homeowners Renovate their Property with Natural and Engineered"
oceans,[removed],Table of sea floor temperatures?
oceans,,Cuttlefish are so beautiful!
oceans,,Pacific Ocean at sunset
oceans,,Eagle trained to take down drones. InterestingAsFUKC
oceans,,Huge Great White Shark Encounter on Cape Cod
oceans,,How Octopuses ‘Taste’ Things By Touching
oceans,,"Ocean Waves 4K Ocean Waves Sounds for Relaxation, Meditation or Study"
oceans,,Cliff near beach - cinematic video
oceans,,Orange Ocean Sunset
oceans,,The Real Reason You Can't Bring Water Bottles Through Airport Security
oceans,"I realize this is a really random question, and maybe not appropriate for this subreddit, but I’ve always wondered and figured I might as well ask. 

I’m always horrified to learn that so many shipwrecks kill large numbers of people, and I can’t help but wonder what the reason is. I’m not being facetious here: are there really that many people that don’t know how to swim? Or can they swim but they get tired and give up when rescue takes too long? Or do they freeze to death? Or eaten by sharks? Or sucked under with the ship? What are the most common reasons for death after a shipwreck?",Why do so many people die in shipwrecks?
oceans,,Dolphins love
oceans,,The most beautiful sea in the world
oceans,,"Anglerfish Unusual Mating - First Ever Footage Of Strangest Creature Reproduction. More interestingly, in some fish there can be multiple males incorporated into a single female, with some species having up to eight males per female."
oceans,,20000 Lieues sans les Mers - piece done for the Halloween virtual studio art show.
oceans,,"The head of dolphins consists of very strong and thick bones that act as biological body ram. They will slam their snouts into the soft stomach of the shark , causing the shark to serious internal injuries."
oceans,,Understanding the Earth: the contribution of Marie Tharp
oceans,,How Brazilians Conquered Surfing
oceans,,Australian Institute of Marine Science has a huge sea simulator used to spawn and study corals. They captured this amazing video of coral larvae developing into single coral polyps.
oceans,,Please share our GoFundMe. OpenLitterMap - A Revolutionary App to Map Litter. We need your help to bring OpenLitterMap to the next stage!
oceans,,"Scientists Accidentally Discover Massive, Skyscraper-Sized Coral Reef On Great Barrier Reef"
oceans,,Please watch!!! The entire world needs to see. 😢
oceans,,I drew an ocean wave in Procreate! OC
oceans,,Sleep Wellness Fall Asleep Fast
oceans,,"Sunflower sea stars are the fastest moving sea stars that move up to 1 meters per minute by using 15,000 tube feet which located on the undersides of their bodies. With the amount of rays they have, they are able to extend its mouth enough to get large prey."
oceans,,"Meet The Humboldt Squid - The Aggressive Squid Of The Deep, ""Piranha Squid"""
oceans,,"Meet Humboldt Squid - The Aggressive Squid Of The Deep, ""Piranha Squid"""
oceans,,"The ""Julia"" sound, An actual loud and creepy sound from the ocean"
oceans,,"Today marked the finale of one woman’s journey around Maui, hiking 180 miles around the entire island’s coastline to raise awareness against ocean plastics and raise funds for Love The Sea’s Hard to Reach (H2R) beach cleanups."
oceans,,"Today marked the finale of one woman’s journey around Maui, hiking 180 miles around the entire island’s coastline to raise awareness against ocean plastics and raise funds for Love The Sea’s Hard to Reach (H2R) beach cleanups."
oceans,,Mandarin Fish are such a beauty! Truly the highlight of this dive in the Lembeh Strait!
oceans,,Infomate Pvt Ltd – Sri Lanka–BPO Service Provider | Accounting Outsourcing Services
oceans,,"As Waters Warm, Ocean Heatwaves Are Growing More Severe"
oceans,,"Secret beach in Goa, India"
oceans,,Fall Skimboarding in laguna beach California
oceans,,Rarest One Eyed Baby Shark Found By Fisherman
oceans,,Special Manta Ray Episode🤙
oceans,,Far away from home - relaxing music
oceans,,2020-09-24 my baby kids back again at their school so i and reyes and my...
oceans,,Sander For Removing Paint
oceans,,Haulover Inlet Boats! Boat of the Day!
oceans,,"I Know We All Love To Feed The Ocean The Best Car Batteries We Possibly Can, But I Can't Afford Much. Would Poseidon Be Pleased With This Meager Battery?"
oceans,,"Eco-Friendly Dishes Pose Same Threat to Marine Life Like Plastic Items, Find Israeli Researchers"
oceans,,Beaches in Canada
oceans,,A Venezuelan vessel carrying 1.3 million barrels of oil is tilting — and it could lead to a catastrophic oil spill
oceans,[Humanity and the Deep Ocean | James Nestor](https://youtu.be/aH9boP9pksM),"incredible talk by writer James Nestor about the ocean, the depths and much more."
oceans,,Rough weather at Bay of Biscay.
oceans,,"Anchorage at Antwerp,Belgium."
oceans,,The RCMP have 'let down' Indigenous fishers facing violence in Nova Scotia: minister
oceans,,"During the Miocene Epoch, some 13 million years ago, they competed for the same food and the same turf. When they eventually went extinct it was probably for the same reasons. So who would have been the top predator of the ancient oceans?"
oceans,,why is ocean still unexplored?
oceans,,The Race Against Catastrophe
oceans,,Liquid k2 on paper | k2 spray on paper | k2 spray for sale | liquid k2
oceans,,Save the sea cool design
oceans,,Seven-mile oil spill fouls Delaware coastline
oceans,,Stricken Venezuelan oil tanker raises fears of Caribbean ecological disaster
oceans,"Has anyone been to this exhibit? It looks so cool...wish it would come to my city.

[https://www.waste360.com/plastics/washed-ashore-creates-zoo-sea-creatures-plastic-waste-art-exhibit](https://www.waste360.com/plastics/washed-ashore-creates-zoo-sea-creatures-plastic-waste-art-exhibit)",Washed Ashore Creates Zoo of Sea Creatures for Plastic Waste Art Exhibit
oceans,,"Hammerhead shark is probably the weirdest type of sharks that get their name after specific shape of the head that looks like a flat hammer. The flat shaped head is thought to allow them to detect prey more easily, as it increases the hammerhead sharks sensitivity to sonar activity."
oceans,"Could anyone help me ID these corals? I just need it for a report but don't know anyone who is an expert in the field.

&amp;#x200B;

https://preview.redd.it/iv01jia8f8u51.jpg?width=1280&amp;format=pjpg&amp;auto=webp&amp;s=a6225d49df1355027ab8764fc1500412c8acae5b

https://preview.redd.it/91qdkga8f8u51.jpg?width=1280&amp;format=pjpg&amp;auto=webp&amp;s=703e2d82eada48fe8bf586468e0f4163b6619b0e",HELP! Coral ID
oceans,,HOW CLOSE ARE WE TO LIVING IN THE OCEAN?
oceans,,It was KBB's Bermuda Coastal Cleanup 2020 on Saturday. Amazing effort with 31 teams and over 300 people taking part throughout the island during a pandemic. The BUEI team did an underwater cleanup of the inner harbour in poor diving conditions but all had an utter blast. Amazing effort by all!
oceans,,Sunset on the Oregon coast
oceans,,Northern Cyprus
oceans,,"From coral farming to 3D printing, scientists are using novel methods to save coral reefs"
oceans,,"Brace yourselves. Here comes the Mimic Octopus! Did you know, that the mimic octopus can imitate up to 32 different animals to confuse his predators or his prey? Gotta love the invertebrates in Lembeh!"
oceans,,how close are we to live in ocean?
oceans,,"Manta Ray, A giant of the Ocean"
oceans,,Pufferfish May Be Carving Mysterious ‘Crop Circles’ Near Australia
oceans,,The Ocean is way deeper than you think
oceans,,How often are “ghost ships” found at sea or washed up on the shore having not sunk first?
oceans,,I know the kraken isn’t real but could you imagine?! Drew this today and wanted to share. What do you all think?
oceans,Hello! I am an AI researcher and I have been learning about rip currents. My goal is to develop an app that with the help of cameras on beaches can detect and alert the people on the beach if a rip current is happening. Does anyone know of any videos that I could work on? Thank you!,Rip currents
oceans,,The fastest swimming fish in the ocean
oceans,,Japan to release Fukushima's contaminated water into sea: reports
oceans,,Beach litter mapped. All picked up and the data is open 💚🌎
oceans,"Hi everyone,

We're visiting several different communities on reddit and elsewhere in search of two things:

1. Organizations making an immediate impact to preserve the biosphere and reduce atmospheric carbon that are in need of funding right now.

2. Forests, waterways and other wildlife habitats that are currently available for sale and in danger of being bought by commercial entities such as logging, mining, drilling and development companies. 

Links to existing lists and organizational hubs are also welcome. We want to find ongoing and especially time-sensitive causes that are in immediate need of funding. We're looking to be as comprehensive as possible, so every suggestion is sincerely appreciated!",Looking for ways to benefit the environment through investments
oceans,,The sound of the ocean (Enjoy!)
oceans,"[removed]

[View Poll](https://www.reddit.com/poll/jbrx72)","(poll) who is sexually abused more, girls or boys?"
oceans,,"In the life of a planet, many things could go wrong. Two planets could collide with one another, it could be struck by a damaging asteroid, and eventually, its host star will die. But there are also some other ways that a planet could basically shut down and take a turn for the worse. BUT HOW?"
oceans,,"Our team just released two endangered sea turtles after 6 months of intensive care. The fact that these turtles survived is a miracle, and their excitement seeing the ocean again was infectious. Hope you enjoy this heartwarming short video"
oceans,,Beautiful large waves today
oceans,,Nothing out past that rainbow untill Antarctica (Albany Western Australia)
oceans,,Albany Western Australia (Its got be better than that T-shirt spam bot right?)
oceans,,Ocean
oceans,,One of the dolphin but its looks like a killer whale.. 🤔🐳
oceans,,Red Lipped Batfish - Strangest Walking Fish Of The Underwater World
oceans,,We had an unreal experience whale watching with our drone in South Africa recently. Thought we would share with you all!
