subreddit,selftext,title
oceans,,"These fish are responsible for creating majority of the worlds tropical islands and beaches. Humphead Parrot Fish have monstrous Buck Teeth designed to devour rock, they're as unique as they are oddly beautiful. They eat rock and poo out tropical beaches - literally. Hope you enjoy this mini doco!"
oceans,,Les Tornado allemands quittent l’Irak
oceans,,"Deep sea purple snailfish, 5 miles deep, Atacama Trench"
oceans,,"The lost treasures of the ocean, Amazing ocean sounds amazing statues Beautiful world in our world"
oceans,,The Ocean Cleanup is Working and History is Being Made Cleaning Up The Oceans and Garbage Patch
oceans,,Tagging data show that blue sharks are true globalists
oceans,,"These fish are responsible for creating majority of the worlds tropical islands and beaches. Humphead Parrot Fish have monstrous Buck Teeth designed to devour rock, they're as unique as they are oddly beautiful. The eat rock and poo out tropical beaches - literally. Hope you enjoy this mini doco!"
oceans,,"South Africa’s humpback whales make a stunning comeback: from 300 to 40,000 whales"
oceans,,"Diving with a School of Feeding Humphead Parrot fish is unreal. They're equipped with monstrous Buck Teeth designed to devour rock, they're as unique as they are oddly beautiful. Hope you enjoy this Mini Documentary Film I created on these stunning animals"
oceans,,"Humphead Parrot Fish have monstrous Buck Teeth designed to devour rock, they're as unique as they are oddly beautiful. Hope you enjoy this Mini Documentary Film I created on these stunning animals - Filmed on the Outer Edge of the Great Barrier Reef"
oceans,,"Oceans can be restored to former glory within 30 years, say scientists | Environment"
oceans,,These prehistoric amphibians were scarier than any shark
oceans,,"Oceans can be restored to former glory within 30 years, say scientists | Environment"
oceans,,Amazing deep sea sounds with the lost world of the ocean treasures part 2
oceans,,Ekoru.org is a search engine that donates 60% of its revenue to organizations that remove plastic from the ocean and restore seagrass meadows
oceans,,"2020-03-15 not sport's talk's cuz the corona virus trump made,not good f..."
oceans,,Creatures of the Ocean [Short Cinematic]
oceans,,Deep sea sounds with the lost world of the ocean treasures part 2
oceans,,Everybody loved my Manta Ray sketch so I drew another of a Jellyfish. I love and miss the ocean so much in these tough times. Hope everyone is safe! Thanks for looking
oceans,,Oblique Wave Erosion in Stream Table
oceans,,Spiky Worm’s Ancient ‘Death March’ Might Be Earliest Known Animal Journey on Earth
oceans,,Hey everyone! Been stuck in quarantine thinking about the ocean and drew this! Wanted to show off some artwork of one of my favorite marine animals. What’s yours? Art done by me in sharpie
oceans,,Weird Triassic 'Dragons' Had Massive Heads. Here's Why.
oceans,,"Pacific Ocean Fishing, South of Alaska"
oceans,,Whoa...
oceans,,A Spoon Worm ( Ikeda taenioides ) retreats in a hurry
oceans,,The Great Barrier Reef likely just experienced its most widespread bleaching event on record
oceans,,Prehistoric sea predators could be largest that ever lived.
oceans,,Cute baby
oceans,"&amp;#x200B;

https://preview.redd.it/e7wkqsq44lp41.png?width=930&amp;format=png&amp;auto=webp&amp;s=1b38dff55122a8971575bef6c634c7812d8e4eac",Guess the ocean-themed emojis!
oceans,,G
oceans,,Terrible JIB Crane fall down and broken
oceans,,The shimmering abyss ocean inspired dice
oceans,,Amazing deep sea sounds with the lost world of the ocean
oceans,,"2020-03-15 not sport's talk's cuz the corona virus trump made,not good f..."
oceans,,The Great Barrier Reef Bleaching is at peak.
oceans,,Crew members on vessel tested for coronavirus in Vissai Cua Lo - Vietnam - SVC Marine Services Co Ltd
oceans,,Chronicling 23 Years of Acidification in the Beaufort Sea
oceans,,Freediving on Cook Islands Turtle Sanctuary. We were coming across 20+ turtles each dive! I've never seen so many totally chilled out turtles in my life! Hope you enjoy this short highlight reel from a recent film job I did up there!
oceans,,"A school of squirrelfish I came across during a dive in Hawaii - If you like this, I have tons of more underwater photos on my Instagram: GavinKrohm"
oceans,,Ancestor of all animals identified in Australian fossils
oceans,,"A Conversation with Dr. Sylvia Earle, Webinar. How our depleted and stressed natural systems gave rise to Covid-19"
oceans,,"2020-03-15 not sport's talk's cuz the corona virus trump made,not good f..."
oceans,,Restoring Giant Sea Clams Which Can Grow to 500kg | Hakai Magazine
oceans,,"2020-03-15 not sport's talk's cuz the corona virus trump made,not good f..."
oceans,,10 of the largest living creatures in the sea
oceans,,Coronavirus COVID-19 Dolphins return to venice italy
oceans,"Hey guys. Im quarantined at home so ive set up a livestream of our fish tank. Feel free to request color changes. 
Enjoy

https://m.twitch.tv/jehutyhome",Seawater tank 700L livestream
oceans,,The Challenger Deep in the Mariana Trench is the deepest known location in Earth's oceans and none has gone there.
oceans,,"Rest your body, relax your mind and recharge your soul with this relaxing music."
oceans,,Watch the amphibious fish called the Mudskipper walk on land and breathe air to the song “Slippery” by Migos featuring Gucci Mane.
oceans,,New tools to determine climate-adaptive coral reefs
oceans,,Strangest sea creatures found in deep sea
oceans,,Nature Nurtures Common dolphins | Great Walks | SilenceTV
oceans,,Whales are what ties the ocean’s surface to its deepest depths. Their journeys into the abyss remove millions of tonnes of carbon dioxide from the atmosphere; revealing themselves as an unlikely new ally in our quest to fix climate change.
oceans,,"2020-03-15 not sport's talk's cuz the corona virus trump made,not good f..."
oceans,,Fish sprouted fingers before they ventured onto land
oceans,,Terrible JIB Crane of vessel broken.
oceans,,"A Cinematic short filmed on The Edge of the Great Barrier Reef. While much of the reef is struggling, the outer edges are still gorgeous. Gorgonian Fans the size of mini busses, coral pinnacles bursting with life, and epic shark fuelled night diving! Hope you enjoy this 2minute underwater film!"
oceans,,"2020-03-15 not sport's talk's cuz the corona virus trump made,not good f..."
oceans,,Crew members on MV SHENG CHENG HAI tested for coronavirus in Vissai – Cua Lo – Vietnam
oceans,,Watch these Flying Fish gracefully glide to TheFatRat’s “Fly Away” as they try to avoid being eaten by hungry Mahi-Mahi and Frigatebirds.
oceans,,"2020-03-15 not sport's talk's cuz the corona virus trump made,not good f..."
oceans,What is the difference between manipulating seawater pH by adding an acid vs using CO2 gas?,Ocean acidification
oceans,,Mythical monsters that might have actually existed
oceans,,"Narwhals tusks are actually elongated teeth, can grow up to 10 ft, and can bend up to a foot to one side without breaking. Their purpose is still not well understood. Some narwhals do not have tusks. Their skin is very rich in vitamin C, the same as an orange by weight. There are none in captivity."
oceans,,"2020-03-15 not sport's talk's cuz the corona virus trump made,not good f..."
oceans,,a group of fish that I saw during my trip to Colombia. He had so many. it was amazing
oceans,,"As many as 200,000 coral reefs off Norway"
oceans,,"2020-03-15 not sport's talk's cuz the corona virus trump made,not good f..."
oceans,,"2020-03-15 not sport's talk's cuz the corona virus trump made,not good f..."
oceans,,African killifish may hold key to stopping ageing in humans
oceans,,"2020-03-15 not sport's talk's cuz the corona virus trump made,not good f..."
oceans,,"For decades, scientists puzzled over the plastic ‘missing’ from our oceans – but now it’s been found | CSIRO Australia"
oceans,,"Cuvier's beaked whales hold the record for the deepest and the longest dives ever documented for any mammal. During one study, the longest dive recorded was 137.5 minutes. This was also the deepest dive at 9,816 feet. The whales' rib cages can fold down to reduce air pockets and decrease buoyancy."
oceans,,"Organisms that live around hydrothermal vents do not rely on sunlight and photosynthesis. Instead, archaea, among the first bacteria in existence, use a process called chemosynthesis to convert toxic minerals and chemicals into nutrients. Without them, no multicellular life would exist on Earth."
oceans,,"Ocean Waves at Night (1 Hour) - Relaxing Ocean Waves in the Night for deep Relaxation, by Holocron Music"
oceans,,This May Be The Biggest Turtle That Ever Lived
oceans,,Playing healthy coral sounds under water has attracted fish back to the dead reefs
oceans,,Orc
oceans,,"KEEP WINING STABILITY,FOR I AND MY BABY KID'S REYES AND MY MOTHER DENNIS..."
oceans,,Frequently Asked Questions About the Pew Fellowship in Marine Conservation
oceans,,The Arctic Ocean Has Chlamydia
oceans,,Microbes far beneath the seafloor rely on recycling to survive: 'Scientists from Woods Hole Oceanographic Institution (in Massachusetts East US) reveal how microorganisms could survive in rocks nestled thousands of feet beneath the ocean floor in the lower oceanic crust'
oceans,,Fearsome Triassic 'ocean lizard' was a tweezer-nosed weirdo
oceans,,"KEEP WINING STABILITY,FOR I AND MY BABY KID'S REYES AND MY MOTHER DENNIS..."
oceans,,When Fish Have A Reef Rave Party
oceans,,South Florida to continue pumping partially treated sewerage into ocean until 2025. Up to 188 million gallons of waste water per day.
oceans,,60% Of Life On Earth Is Microscopic
oceans,,UK's lost sea meadows to be resurrected in climate fight | Environment
oceans,,Safety of Fukushima waste water focus of sea release debate
oceans,,Killer Underwater Robot-Drone Eliminates Invasive Lionfish
oceans,,Fishermen turning abandoned fishing nets into surfboards
oceans,,Fishermen turning abandoned fishing nets into surfboards
oceans,,Sea turtles may be attracted to the smell of plastic bags.
oceans,,"Walking on the biggest dune in Europe - Dune of Pilat. This dune is actually between the ocean and a big forest, which makes the atmosphere so unique."
oceans,,"KEEP WINING STABILITY,FOR I AND MY BABY KID'S REYES AND MY MOTHER DENNIS..."
oceans,,Starfish walking on land look alien
oceans,,Helping hand
oceans,,Watch how a sea sponge pumps water (using organic fluorescein dye)
oceans,,A 'social network' may have linked early sea creatures
oceans,,New right whale protection measures announced by Canadian government
oceans,,This 500 million year old 'Social network' may have helped sea monsters clone themselves
oceans,,How cool would it be to cruise with a pod of dolphins?
oceans,,Fire Department Rescues Turtle Trapped In Fishing Net
oceans,,"KEEP WINING STABILITY,FOR I AND MY BABY KID'S REYES AND MY MOTHER DENNIS..."
oceans,,How a Gaming Podcast Promotes Marine Conservation
oceans,,"PepsiCo, Nestle and 8 other companies sued for polluting oceans with plastic products"
oceans,,Cuttlefish disguising itself as coral
oceans,,A massive floating net filled with hundreds of decomposing sharks and other sea creatures was discovered by a group of divers who were swimming near the Cayman Islands
oceans,,"Stony Corals Seem to Be Preparing for a Mass Extinction, Scientists Report"
oceans,,"Questionnaire regarding over-fishing for my university report, appreciate it &lt;3"
oceans,,"KEEP WINING STABILITY,FOR I AND MY BABY KID'S REYES AND MY MOTHER DENNIS..."
oceans,,Weekly Reef health update - 5 March 2020 | Great Barrier Reef Marine Park
oceans,,realestates
oceans,,H.point
oceans,"&amp;#x200B;

![video](gl2z2v6lxuk41 ""Saving our seas one wash at a time"")","Meet the Cleaner Seas Group - removing plastic microfibres from our Oceans one wash at a time. Every time you wash your clothes up to 700,000 microfibres are released into the Oceans. Indikon-1 tackles this at source. https://www.reddit.com/user/AvrilSainsbury/draft/43eebcf6-5ede-1"
oceans,,What the hell is that?
oceans,[removed],Live Civix - Join us making civics a living thing again.
oceans,,"Since the growth of industries, the pH balance of ocean waters has dropped by 0.1 pH units, equivalent to a 30% increase of water acidity."
oceans,,Sharks Are Under Threat: Here's Why And How You Can Help
oceans,,A swarm of floating post it notes in the ocean?
oceans,,"KEEP WINING STABILITY,FOR I AND MY BABY KID'S REYES AND MY MOTHER DENNIS..."
oceans,,Destructive Waves &amp; Winds O:
oceans,,Isn't this crazy!?!? Big deadly waves 2 watch 4 fun !! (:
oceans,,"As Pike Spector goes into the depths of the Aleutians outside of Alaska to investigate kelp forests and urchin barrens, he reflects on whether we are doing enough to stand up for our biodiversity."
oceans,,I Love Abalone - Music Video
oceans,,"The Ocean Protection Council on Wednesday approved the Strategic Plan to Protect California's Oceans, a five-year roadmap for navigating threats including climate change, pollution and loss of biodiversity."
oceans,,"KEEP WINING STABILITY,FOR I AND MY BABY KID'S REYES AND MY MOTHER DENNIS..."
oceans,,Water acidification and the harsh reality of ocean chemistry.
oceans,,Ocean Changes Almost Starved Earth Life Of Oxygen
oceans,,You Can Now ‘Reforest the Oceans’ One Online Search at a Time Thanks to This New Search Engine
oceans,,"KEEP WINING STABILITY,FOR I AND MY BABY KID'S REYES AND MY MOTHER DENNIS..."
oceans,,60-year-old surfer fights off Great White shark by punching it
oceans,,Watchtower in the ocean
oceans,,"Dutch 'Boy Genius' who has been cleaning up Pacific Garbage Patch is now clearing the world’s rivers responsible for depositing most of the ocean trash. His latest creation, The Interceptor, is a solar-powered barge which can collect up to 55 tons of garbage daily."
oceans,,UK's Sussex council bans coastal trawler fishing to cut greenhouse emissions + revive kelp forests
oceans,,this browser extension is such a neat idea! please add and it works just as well as google. for every 5 searches you make they save 1 plastic bottle from horrible sea creatures. haha just kidding but seriously its so cool
oceans,,Oahu Wrecks and Reef Scuba Diving - Hawaii
oceans,,The lost continent of Zealandia hides clues to the Ring of Fire's birth
oceans,,Plastic and Waste Pollution Survey Please take a minute to take this survey and to help influence a better tomorrow. Thank You
oceans,,A Turtle Uses An Invisibility Cloak To Hide From Sharks
oceans,,Plastic trash kills half a million hermit crabs on remote islands each year
oceans,,Ever wondered why dolphins spin?
oceans,,13 foot table transformed into ocean waves
oceans,,"""The Bloop"" is a mysterious underwater sound recorded in the 90s, which was thought to have originated by some mysterious sea monster."
oceans,,The Ocean Cleanup - Donate to save our seas!
oceans,"Are there any good podcasts that you would recommend? I have a new job where I have to sit for a good 8-10 hours a day and would like to listen to some educational podcasts about the ocean and general marine science while I work. Ideally, I would like the podcasts to be available on Spotify and/or Apple Podcast. TIA!",Looking for a podcast to listen to while at work
oceans,,"KEEP WINING STABILITY,FOR I AND MY BABY KID'S REYES AND MY MOTHER DENNIS..."
oceans,,"Is salt-tolerant rice growing in the ocean by 2021? Nevertheless, ocean agriculture is a rising form of food production with real potential."
oceans,,300 endangered sea turtles found dead in abandoned fishing net off Mexican coast
oceans,,Blue Whales Bouncing Back From Brink Of Extinction After Decades Of Decline
oceans,,"How Ocean Cannabis Company is Cleaning the Ocean, One Vape Cartridge at a Time"
oceans,"Apologies if this has alredady been asked a thousand times - On a friend recommendation my daughter and I brought bracelets (extra $20+ just to mail to Aust). Then I looked online and found a lot of criticism of them. I assume they do a good job, however are they really more about owner profit? If so, then who should we look to donate to that does a better job and not for keeping personal wealth?? Thanks.",4Ocean bracelet - real change or owner profit - who else am I better donating to?
oceans,,"KEEP WINING STABILITY,FOR I AND MY BABY KID'S REYES AND MY MOTHER DENNIS..."
oceans,,Glow In The Dark Dolphins From Luminescent Plankton
oceans,,A browser to save the ocean.
oceans,,"Coast on Nusa Lembongan, Bali"
oceans,,The Massive Bull Sharks and Beautiful Marine Life of Fiji's Beqa Lagoon
oceans,,Somali beach goers help a stranded 10 meter Whale Shark
oceans,,Eagle Rays in local Metro Melbourne (Australia) Marine Sanctuary - Bonus Banjo Sharks
oceans,,Coral reefs could vanish by 2100. Before-and-after photos show it now.
oceans,,Bizarre cousin of jellyfish doesn’t breathe oxygen
oceans,,"Global Sea Temperature From 7,000 Sensors Updated Daily"
oceans,,"KEEP WINING STABILITY,FOR I AND MY BABY KID'S REYES AND MY MOTHER DENNIS..."
oceans,,Underwater Photographer of the Year
oceans,,Divers found a massive fishing net with hundreds of decomposing dead sharks
oceans,,Where Does One Ocean End And Another Begin?
oceans,,"Hey guys, I'm sure is not the place but...I'm from Argentina, seek of seeing plastic everywhere I started this project in order to do something with it. We focused on plastic bags because just 1% of the global production is recycled, and is one of the hardest plastic items to reuse."
oceans,,Gill-Clogging Slime Secretion in Hagfishes
oceans,,"Science on Tap - Hagfish Biomimetics, Profound Lessons from the Deep Sea, Dr. Doug Fudge, Chapman University (2019) Fish can't eat hagfish. Even sharks recoil in disgust when they try. Link to video of that in comments."
oceans,,"KEEP WINING STABILITY,FOR I AND MY BABY KID'S REYES AND MY MOTHER DENNIS..."
oceans,,"You May Find Salt-Tolerant Rice Growing In The Ocean By 2021: 'They want to grow rice in the ocean by using gene-editing, Salt-tolerant rice could be grown in salty ocean water without the use of soil, fertilizer or fresh water.'"
oceans,,Since people are posting Megalodon videos. Heres my favorite one.
oceans,,Our oceans are dying.
oceans,,HOW BIG IS THE MEGALODON SHARK ?
oceans,,"KEEP WINING STABILITY,FOR I AND MY BABY KID'S REYES AND MY MOTHER DENNIS..."
oceans,,"Because of global warming, the icebergs are melting, causing the sea levels to rise. In Europe, 25 million people will be left with no homes by the year 2050 if we don't do something...like damming the entire North Sea. If we do this, this insane plan will have some consequences."
oceans,,Can coral reefs live climate change and a warming ocean?
oceans,[deleted],Ocean in motion
oceans,,SoFarOcean Real Time Ocean Data Dashboard
oceans,,Livestream - Feb 22 Schmidt Oceans ROV SuBastian in Perth Canyon Australia
oceans,,"KEEP WINING STABILITY,FOR I AND MY BABY KID'S REYES AND MY MOTHER DENNIS..."
oceans,,Coronavirus has temporarily reduced China’s CO2 emissions by a quarter
oceans,,"Coral Identification Help, What is this? (Providenciales - Turks &amp; Caicos)"
oceans,,Seafloor images reveal the secret lives of sponges
oceans,,"Around 70-90% of coral reefs are likely to disappear in the next 20 years because of warming oceans, acidic water, and pollution, said scientists from the University of Hawaii Manoa."
oceans,,"Climate change could destroy all of Earth's coral reefs by 2100, scientists warn"
oceans,,The Next Ocean Plastic Frontier – 4ocean’s Incredible Project Guatemala
oceans,,"Great Barrier Reef on brink of third major coral bleaching in five years, scientists warn"
oceans,,Made a video of my recent dive trip in Fiji! It includes some pristine coral reefs and some amazing marine life I thought the community might enjoy!
oceans,"Dorsal has formed an incredible partnership with Ocean Blue Project, a non-profit organization whose mission is to protect the world's oceans, coastal waterways, and rivers through cleanups. 

Each month, Dorsal collaborates with and makes a donation to Ocean Blue Project, to help further their efforts in our shared mission. We remove one pound of trash, for every purchase!

So far, the company has removed 18, 411 pounds of trash from our beaches and oceans

If you would like something from the store - please follow the link below for a discount! 

[rwrd.io/jy8qzs1](https://rwrd.io/jy8qzs1)","GREAT CAUSE! Cool t-shirts, bracelets etc.!!"
oceans,,Making Waves
oceans,,2020-02-11 I BATTLE alone with my illness for i and my baby kid's reyes...
oceans,,2020-02-11 I BATTLE alone with my illness for i and my baby kid's reyes...
oceans,,In pictures: 'Ghost ship' washed up by Storm Dennis
oceans,,"The Deepwater Horizon Oil Spill Was a Cover-Up, Not a Cleanup"
oceans,,LITTERBASE: Interactive Global Map For Marine Litter And Microplastic
oceans,,North America’s largest ferry system is converting from diesel to hybrid-electric engines
oceans,,"Livestream - Feb 19th - Schmidt Ocean's ROV SuBastian in Perth Canyon, Australia Dive 327"
oceans,,Heartbreaking AR Experience Exposes Fishing Industry's Hidden Cost
oceans,,"Cuttlefish eat less for lunch if their favourite food is on the menu later, research finds"
oceans,,2020-02-11 I BATTLE alone with my illness for i and my baby kid's reyes...
oceans,,"this is NOT even my product. I just thought i should share this with you guys, because these rings are honestly amazing omg.. I bought myself one and also one for my girlfriend. If anyone is wondering, u can buy them on oceanwavering.com (and again this is not an advertisement, its a recommendation)"
oceans,,How we're saving the world’s rarest fish - CSIROscope
oceans,,Recently I went snorkelling to the Red Sea and I was amazed how the reefs were in such a good condition despite heavy tourism. Today I learned about the importance of the Red Sea in the future.
oceans,,Deep-Sea Coral and Canyon Adventure - Whale Fall - FK200126
oceans,,"Peruvian Government Proposes New Marine Reserve Harboring 1,100 Species"
oceans,,"4ocean Has Removed More Than 7 Million Pounds Of Trash, Expands Bracelet-Funded Cleanups To Central America"
oceans,,"Animals of the very deep change the very molecules which make up their cells in order to survive the extreme pressure, which is why the blobfish looks so disgusting when we bring them to the surface. So what could we do to scuba dive to these depths?"
oceans,,Study identifies the first potentially invasive species to reach the Antarctica on drifting marine algae | Eco Planet News
oceans,,Live - Schmidt Oceans ROV SuBastian in Leeuwin Canyon Southwest Australia Dive 325
oceans,,2020-02-11 I BATTLE alone with my illness for i and my baby kid's reyes...
oceans,,Looking into the Abyss: 6 of the Most Alien-Looking Animals in the Mariana Trench
oceans,,Mobile Phone Experience to Raise Awareness of Dolphin Bycatch
oceans,,Artist FuturePunk creates a series of artworks depicting Marine pollution
oceans,,Things You Must Know About HUMAN EVOLUTION
oceans,[removed],Hey everyone.
oceans,,Tardigrade taking a poo
oceans,,First-of-its-kind study examines toll of nuclear war on world’s oceans
oceans,,Civilization on the move - Santorini and the Sea People
oceans,Would it be theoretically possible to house all 12m stateless individuals in massive underwater buildings made out of a material like tungsten?,Creating an underwater city?
oceans,,Me.
oceans,,Sea Monsters - Size Comparison (Part 2)
oceans,,Live - Schmidt Ocean's ROV SuBastian in Bremer Canyon Southwest Australia
oceans,,Live - Schmidt Ocean's ROV SuBastian in Bremer Canyon Southwest Australia
oceans,,Iceland didn’t hunt any whales in 2019 – and public appetite for whale meat is fading
oceans,,Tuna supply chains under scrutiny as Bumble Bee brand changes hands
oceans,,You must have seen this picture but today I have found the Actual footage of these two waters Having a border
oceans,,Beauty below Murray's beach Jervis Bay
oceans,,60% Of Life On Earth Is Microscopic
oceans,,"Yes, That Pink Manta Picture Is Real"
oceans,,"This is just horrible. What is the point of brutally killing three dolphins? If anyone has any information, $20,000 can go a long way."
oceans,,Sea Monsters Size Comparison
oceans,[removed],Can someone help me find out the extent of this beach erosion?
oceans,,The Mysterious 'Tully Monster' Just Got More Mysterious
oceans,,The Gray Whale's the Very Best Wingman (song about whales)
oceans,,Jaws Did Nothing Wrong
oceans,,"1,400 Pounds of Shark Fins Seized in Miami"
