subreddit,selftext,title
oceans,"In 2018 Scientists have predicted that the earth will be completely underwater in 15 years. In order to preserve human life the governments of the world are organizing a Marine Settlement Mission in order to prepare for the inevitable flooding. These settlements are located at the mid-ocean ridges in the Atlantic and Pacific oceans. Funding for these marine townships is being direct by the Ocean People’s Living Foundation (OPLF). Families of five and above will be the first available for application processes. With Nations such as Russia and China, more aquatic civilizations will begin construction in December of 2020 when the tidal season is at its lowest point. These settlements will be comprised of tunnel chambers, food storages, medical wings, communication offices, and many more useful and essential foundations. Applications can be found online at www.oceansettlement.com and must be submitted before December 2019. Please be aware space is limited in the marine settlements- Mars settlement applications are available at www.Marsishome.com.",Earth is sinking
oceans,,OCEAN RISING: Scientists are using information from the Marine Human Resource Association(MHRA) to create eco-skeletons that will allow humans to breathe under water. The government is slowly beginning to create underwater settlements at the mid ocean ridge in the Atlantic and Pacific oceans.
oceans,,Pacific Seamount Expedition 2019 Livestream. Exploring the depths of the PNW's volcanoes!
oceans,,"Your Old Bra Clasps Can Save Injured Turtles: The clasps are glued on either side of a shell fracture, then pulled together with a zip tie to stabilize the injury"
oceans,,Panama becomes first Central American nation to ban plastic bags
oceans,,Let's slap some aquaman cheeks!
oceans,,Dozens of dead beached whales have been spotted by sightseers during a helicopter flight over western Iceland.
oceans,,Let's clean up our oceans! It can't swallow all of us!
oceans,,Let's clean up our oceans! It can't swallow all of us!
oceans,"This t-shirt is made from 50% post-consumer recycled fabric and 50% organic cotton. There are no microplastics in this garment, so it's kind to the earth and  the sea.

&amp;#x200B;

https://i.redd.it/shz0psb7wab31.png

&amp;#x200B;

 [https://shyandmighty.co.uk/product/save-our-seas-loose-fit-infinitee/](https://shyandmighty.co.uk/product/save-our-seas-loose-fit-infinitee/)",New shirt for anyone that loves the ocean
oceans,[https://docs.google.com/forms/d/e/1FAIpQLSfkedXutEiFlKoXH005W81NJ7LFUpe-51fWfYWUFm-4HCZN-w/viewform?usp=sf\_link](https://docs.google.com/forms/d/e/1FAIpQLSfkedXutEiFlKoXH005W81NJ7LFUpe-51fWfYWUFm-4HCZN-w/viewform?usp=sf_link),[Academic] Hi all! We're doing a research on how you contribute to resolving cigarette waste online.
oceans,,"Swimming with Fur Seals is breathtaking - I've never experienced wildlife interaction like it! They hardly left our side, spending the entire time we were in the water wizzing around us trying to play! Hope you enjoy the 1min cinematic film"
oceans,,Watch an Ocean Ecosphere exist inside of a River Ecosystem
oceans,,"Presentations by ocean/fisheries experts: Daniel Pauly, John Tanzer, Jessica Meeuwig, Oceana"
oceans,,The Most Dangerous Place In The World Is No Longer Chernobyl: It Is In The Middle Of The Pacific (VIDEO)
oceans,,"Humans May Be Accidentally Geoengineering the Oceans - Iron particles released by industrial activities are falling into the seas in greater quantities than previously thought. Known as “iron fertilization,” it could promote the growth of phytoplankton, which naturally suck up carbon dioxide."
oceans,,"For the first time in 17 years, there will be no commercial whaling in Iceland after the sole company certified to hunt whales failed to renew its license. Hvalur hf, which exports most of its product to Japan, cited a shrinking appetite for whale meat as the reason for foregoing the hunt."
oceans,,"For the first time in 17 years, there will be no commercial whaling in Iceland after the sole company certified to hunt whales failed to renew its license. Hvalur hf, which exports most of its product to Japan, cited a shrinking appetite for whale meat as the reason for foregoing the hunt."
oceans,[removed],"Maredis Apparel Announces Fall ""Clean Vibes, Clean Oceans"" Discussion hosted at the University of Southern California, LA"
oceans,[removed],"Maredis Apparel Announces ""Clean Vibes, Clean Oceans"" Discussion hosted at the University of Southern California, LA"
oceans,,Why did that fish eat that shark?
oceans,,A look at 50 ways to use less plastic
oceans," 

New blog up on my website!

[https://ecorul.com/2019/07/16/ghost-nets-the-war-on-coral/](https://ecorul.com/2019/07/16/ghost-nets-the-war-on-coral/)

"" More than 650,000 marine animals die from fishing nets each year, these animals include dolphins, seals, whales, fish, crustaceans, and turtles. “Ghost nets” are fishing nets that are abandoned or lost at sea from fishing boats, these nets will continuously fish for months, possibly years that will sweep the ocean floor unattended. Ghost nets will drag along the ocean floor killing innocent sea life......""

Continue reading at [https://ecorul.com/2019/07/16/ghost-nets-the-war-on-coral/](https://ecorul.com/2019/07/16/ghost-nets-the-war-on-coral/)","Ghost Nets, The War on Coral"
oceans,,"Maredis Apparel Announces ""Clean Vibes, Clean Oceans"" Discussion hosted at the University of Southern California, LA"
oceans,[removed],"What’s the coolest, most unique thing you’ve ever seen while diving"
oceans,,For The First Time In 17 Years: Iceland Will Not Hunt Any Whales This Summer
oceans,,Save Our World 🌍
oceans,,The Truth About Plastic in The Ocean | Environment Protection United
oceans,,"'Inside, the fish are black': the pollution tainting Tunisian beaches. Across the Gulf of Tunis, domestic and industrial waste is pouring into the sea, rendering stretches of coastline ‘unusable’"
oceans,,This is how many fish one plastic bottle captures. Now imagine how many plastic bottles are killing life the ocean.
oceans," 

Our Website:  
[https://ecorul.com](https://l.facebook.com/l.php?u=https%3A%2F%2Fecorul.com%2F%3Ffbclid%3DIwAR1S354a0P4v0QjiFvPboynaxBGmCWKyRHa-n-q5urD7G12s8jGDbTLON-Y&amp;h=AT28FrqiFLhMg-RFpgMPYt2642keuag7cvyHgYrokZyh4YIW7kMq9pkOWPFM9lI0RAuB6bJREQFwdFYnAJp913uyE3gQ0a__V5IbS0m6Uj2l-YSTYb6HJarVfL9Gd9FKIFtOuhnsSIzHNwHp5iSzG5GAr6F3cXieUPvsl4iFsa3O8AfrT5euY-VhgrCAI1rr4BhaxG8CdJyOt20_OYVu7OcoRCf5Wn1uFlSDvGg80J1b8XwSncEkSXN5hQapYtX45MrYSg7HAA68E2A7IXobdAR_RbREEYh7zq6dvKK6rxW1kIrp5V2v8mU-zoHW8nxWFm8VlO1GOIzaFjzd3xrUlT_2zFGhghIqg5u6xaFRaY25C4dZWtaiU4oEvUN9nsUi2rgXncuiWPtLX5g9TWz8PiD1DlElpC-OmHs7bFEAzf1sk8JUJlJrjtsAaN4tIGDsu44k4ykLecY1MrsyJZK47hfF45YKoHMXOwhNw9LHREAgFP1S_capxD75tf6wiHGV3NBKmkAfmH2wE4Re4dG1a5YYX4DcqQ3Bj6dltNKrpM0PsE1apCv0gOvjUF2ZgkuXK_qV2Id5OrP26PVPz5oU8igL_VgxV-L_-lwI737DkASXz8VzKV_fNHJpHJ2y-pOP_fpiWwym)

&amp;#x200B;

![img](9r6yrl2ad4a31)

Enter for your chance to win some Reusable Silicone Straw with Carrying Case! Just follow the rules in the picture and we will be selecting 5 winners on 7/21/19!  
Ecorul's Instagram: [https://instagram.com/ecorul.savetheworld/?hl=en](https://l.facebook.com/l.php?u=https%3A%2F%2Finstagram.com%2Fecorul.savetheworld%2F%3Fhl%3Den%26fbclid%3DIwAR1DL_hIJGjYDGhP7d85mMglhIZU7OScjIfkOxenNFJnhRQbmHt8DrjLKVo&amp;h=AT3IpbGyEzohsYMdEpJk7XMxbX2kv4oug0tK9LVlJSzk8fg74D2kyA1VwCr6RtttutvyvFypnBr-lFt93ivUgz4EeVXLI1HGoBWT4G_Fpw9uSjV2U72du3hzoQriZkSDekL7Q843YER-UT20OeHrXuXHwLpi2bu0hOACujDE_zGQR-qV6O2spY_7O9uEKu57_-QT2i4KxJQVo6OTbrpNS85nL9-TQ0g0jexR_uCEV51Bhg2NuwgLW-FYOcF_wvA5WNSxNYelAEg_IejOOikFxhHabAd7xB2ins-cvCXYsB45tMmpecYn4FDokysjGEANXhT6FM8YTSdlmNgg3sqhtuqGU4PV5W12P57PPGVni1sHQ_zO4jUK7Xo8EQmJXUHZpYdNvhqHsFC5K7fdh0K1GnUo82AnTd4B2PnpjvaV46FVfpGAEQJ7H52Z1zELQoyj4jWmLTiNpeNpbZ0VFKCYYekrjWL0DqezRJrZuEVzJ4kVOPd6pA1sTofXsZqCPFM1y_Xxxo6BOM6g9wqzZY4qw_AF5N-ldf-mQx-PW70qzr-S3_0ZUDw1Vo_NXre4R83mFxK8HyO_PV0b4BLZAguGonH7TLcgC4ZuIjBle0tqfWFQmmxxliWCfFHJNHUaKUQvvkK16kBh)

The Product you will win:  
[https://ecorul.com/…/collapsible-silicone-straw-with-carry…/](https://ecorul.com/product/collapsible-silicone-straw-with-carrying-case/?fbclid=IwAR1WNWq84FCyoSXZtwYPIjJeczyDfHNaev_GFgTRvirAlqThJxREPssjENg)

Our Website:  
[https://ecorul.com](https://l.facebook.com/l.php?u=https%3A%2F%2Fecorul.com%2F%3Ffbclid%3DIwAR1S354a0P4v0QjiFvPboynaxBGmCWKyRHa-n-q5urD7G12s8jGDbTLON-Y&amp;h=AT28FrqiFLhMg-RFpgMPYt2642keuag7cvyHgYrokZyh4YIW7kMq9pkOWPFM9lI0RAuB6bJREQFwdFYnAJp913uyE3gQ0a__V5IbS0m6Uj2l-YSTYb6HJarVfL9Gd9FKIFtOuhnsSIzHNwHp5iSzG5GAr6F3cXieUPvsl4iFsa3O8AfrT5euY-VhgrCAI1rr4BhaxG8CdJyOt20_OYVu7OcoRCf5Wn1uFlSDvGg80J1b8XwSncEkSXN5hQapYtX45MrYSg7HAA68E2A7IXobdAR_RbREEYh7zq6dvKK6rxW1kIrp5V2v8mU-zoHW8nxWFm8VlO1GOIzaFjzd3xrUlT_2zFGhghIqg5u6xaFRaY25C4dZWtaiU4oEvUN9nsUi2rgXncuiWPtLX5g9TWz8PiD1DlElpC-OmHs7bFEAzf1sk8JUJlJrjtsAaN4tIGDsu44k4ykLecY1MrsyJZK47hfF45YKoHMXOwhNw9LHREAgFP1S_capxD75tf6wiHGV3NBKmkAfmH2wE4Re4dG1a5YYX4DcqQ3Bj6dltNKrpM0PsE1apCv0gOvjUF2ZgkuXK_qV2Id5OrP26PVPz5oU8igL_VgxV-L_-lwI737DkASXz8VzKV_fNHJpHJ2y-pOP_fpiWwym)",Reusable Straw Giveaway!
oceans,,Sea turtle eating jellyfish like candy
oceans,,Environmentalists have removed nearly 40 tonnes of trash from the Great Pacific Garbage Patch: The latest annual clean-up voyage by the non-profit Ocean Voyages Institute used satellite imagery to specifically target discarded fishing gear.
oceans,,Please help me identify this thing. Spotted while snorkeling in the rea sea.
oceans,,Two Southern resident killer whales missing as experts fear for the population
oceans,,YouTube
oceans,,"To the left is a harbor hundreds of feet deep. To the right is the largest city in Australia. These two vastly different worlds are intimately connected. The city likely would never have been built if not for the existence of the harbor, and the entire face of the harbor was changed by the city."
oceans,"See the ocean as a system, come to OceanPlanetConference on October 18th and 19th, Los Angeles, CA  [https://www.facebook.com/OceanPlanetFIE/videos/388757275093958/](https://www.facebook.com/OceanPlanetFIE/videos/388757275093958/)",Let's see the big picture.
oceans,,A Plastic Ocean | Plastic Pollution | Nature Documentary
oceans,,"[DISCUSSION on r/IAmA]: I’m Randi Rotjan, marine biologist ＆ researcher at Boston University. I study global change in oceans. AMA about microplastic pollution, conservation biology, marine ecology, coral reef health ＆ more"
oceans,,"Diving deeper into the ocean, explore the mid ocean layers"
oceans,,Coral Reefs Shifting Away from Equatorial Waters
oceans,,Why Ghosts Should Not Be Fishing!
oceans,,Orcas May Turn Great White Sharks into Scaredy Cats
oceans,,RuneScape&amp;reg; Bot - RuneScape&amp;reg; Mobile Bot - OSRS Bot - TRiBot
oceans,,"Study Warns Melting of 'One of the World's Most Dangerous Glaciers' Could Cause 20-Inch Sea Level Rise: NASA scientist says that ""after reaching the tipping point, Thwaites Glacier could lose all of its ice in a period of 150 years."""
oceans,"plastic straws are used by Americans 370 millions times a day, the amount that ends up in a recycling bin is a mere fraction( Also plastic straws are mostly made of plastics that are hard to recycle). These also take 500-1000 years to fully decompose. One metal straw will last you an entire lifetime and surprising enough takes 450 years to decompose! One metal can replaces hundreds of thousands of not millions of straws. The amount of manufacturing that goes in to producing one metal straw is nothing compared to that of the equivalent of plastic straws! If you purchase one of these metal straws ( [https://ecorul.com/product/4-pcs-reusable-stainless-steel-drinking-straw/](https://ecorul.com/product/4-pcs-reusable-stainless-steel-drinking-straw/) ) make sure you grab a carrying bag aswell! seen below

 [https://ecorul.com/product/straw-bags-mutil-color-reusable-straw-linen-storage-bag/](https://ecorul.com/product/straw-bags-mutil-color-reusable-straw-linen-storage-bag/) 

https://i.redd.it/a4vibmv5qb931.jpg

https://i.redd.it/jr8upsu5qb931.jpg

https://i.redd.it/sa9j0su5qb931.png",(METAL VS PLASTIC STRAWS) - Straw Linen Storage Bag
oceans,,Save our Seas
oceans,,"URGENT: I just got prescription medicines for this, but need help figuring out what stung me! See comments section for more details."
oceans,,Greek water beauty
oceans,,Is the 4ocean bracelet a scam?
oceans,,Big seaweed bloom dunno if anyone loves seaweed here but here you go
oceans,,Wedges 😀
oceans,,"Largest aquarium tank in the world, Chimelong Ocean Kingdom, Hengqin, China"
oceans," They are Eco-friendly, Non-toxic, washable, organic, Biodegradable, reusable, long-lasting, can be used for a year.Alternatives to cling film, ordinary plastic bags, silicone food covers, etc.,Can be widely used to wrap vegetables, fruits, bread, sandwiches, cheese, and your leftovers, lunch boxes, etc. All natural product that will help reduce plastic use

\#savetheocean 

&amp;#x200B;

 [https://ecorul.com/product/3pcs-reusable-beeswax-wrap-washable-organic/](https://ecorul.com/product/3pcs-reusable-beeswax-wrap-washable-organic/)",Stop plastic! Use some Beewax wrap! 3PCS Reusable Beeswax Wrap Washable Organic
oceans,,"Seven-Eleven Japan to wrap its billions of rice balls in bioplastic: 'By replacing part of the wrapping with a sugar cane-derived material, it can reduce the use of plastic by 260 tons and cut CO2 emissions by 403 tons a year.'"
oceans,Honestly it's an oceanography question I was asked and I can't figure out a logical answer- Please enlighten me!,What time of *the year* are tides highest and why?
oceans, These have proven to be the best for constant use and the ease to use them! they are easily portable and aren't a hassle to remove and replace back in their case! I bought mine here- [https://ecorul.com/product/collapsible-silicone-straw-with-carrying-case/](https://ecorul.com/product/collapsible-silicone-straw-with-carrying-case/),Best Reusable Straws!!! Collapsible Silicone Straw with Carrying Case
oceans,"&amp;#x200B;

[https://medium.com/global-hitchhiking/the-rescue-of-fishing-vessel-battuta-ad7876f6ffeb?source=friends\_link&amp;sk=9e72ab47dc727a31fc1033092f39b880](https://medium.com/global-hitchhiking/the-rescue-of-fishing-vessel-battuta-ad7876f6ffeb?source=friends_link&amp;sk=9e72ab47dc727a31fc1033092f39b880)",The Rescue of Fishing Vessel Battuta: The Night We Saved Eight Souls in the Indian Ocean!
oceans,,Magnificent Pacific Ocean Coast In California Filmed With Drone | 4K
oceans,,An old path to the sea
oceans,,"Scientists Fear Extinction After Six Rare Right Whales Die In A Month: 'There are only some 400 of the animals left on Earth, and fewer than 100 of them are females of reproductive age.'"
oceans,[removed],"Leonardo at 500: Nature’s Magic Ingredient – Water 26 July, British Library 6-30pm"
oceans,,Nestle has launched a new recyclable wrapper for a snack bar that it claims will degrade in a marine environment within six months.
oceans,,Placing an Ocean Ecosystem inside of a River Ecosphere
oceans,[removed],I’m on a quiet beach on Elba island and had to goto the bathroom (poop). Is it bad that I swam out and went in the water?
oceans,,Flesh-eating bacteria has infected 2 children and killed a 77-year-old woman in the last month. Experts say this will become more common in the US as ocean water warms.
oceans,,"Zebra urchin crabs live on the backs of sea urchins in the Indo-Pacific. Females stay on one urchin, while males visit many urchins to mate. Offspring go through several planktonic larval stages in open water until they reach maturity. We saw this one with a clutch of eggs in Anilao Philippines."
oceans,,50 Minutes to Save the World
oceans,,"A photo I took a few years ago while cruise ship, unedited &amp; no filter."
oceans,,Empty ocean
oceans,,Antarctica has lost more ice in four years than the Arctic has in 34 years
oceans,,"The Gulf of Mexico could see one of its largest dead zones on record this summer, according to researchers."
oceans,[removed],What are the recent shark population statistics?
oceans,,"Arctic sea ice on Alaska’s coasts is melting far earlier than normal this year, leading rural residents and scientists to sound the alarm that there could be negative impacts on fish, sea birds, and seals in the area"
oceans,,"Subtropical Summer Storm Stirring the Surf in Boynton Beach, Fla."
oceans,,20 Things You can do to reduce Plastic Pollution
oceans,,North Atlantic Right Whales Are Dying in Horrific Ways (xpost r/StopFossilFuels)
oceans,,40 tons of fishing nets retrieved in Pacific Ocean cleanup
oceans,,'Balloon ban’ passed in Australian city due to impact on marine life
oceans,,My other reviews from Romania
oceans,[removed],Nature's Magic Ingredient - Water
oceans,,Book review – Vanishing Fish: Shifting Baselines and the Future of Global Fisheries
oceans,,Beached whales
oceans,[removed],Sign the Petition to Ban Disposable Plastic Items in Pennsylvania
oceans,,Ocean Plastic Is Now Forming Crusts On Rocky Shores
oceans,,"In 1 hour (10am PST), NSF will broadcast on Facebook from on-board the R/V Atlantis concerning the Regional Cabled Observatory off of the Coast of Oregon"
oceans,,50 Minutes to Save the World
oceans,,Get Your Kicks on 'Plastic' Route 66 ~ Plastic Waste Polluting the Oceans Recycled and Rebuilt into America's Classic Highway.
oceans,,Great way to create awareness and reduce pollution. Puerto Peñasco Son. Mex. 🌎🏝️🌊
oceans,,"Beautiful sunset at Laguna beach, California"
oceans,,How Commonwealth Blue Charter is saving the world’s oceans
oceans,,Sea Wall Guide: What Are the Advantages and Disadvantages?
oceans,,Meet the Kerala fisherman who has removed 3.5 tonnes of plastic from the sea
oceans,,Anita St skimboarding
oceans,,What is this? Found washed up by Seashells? Looks like it could be some type of coral that had died and hardened up.
oceans,,"Organic Carbon Hides in Sediments, Keeping Oxygen in Atmosphere"
oceans,,Joe Manausa Real Estate | Luxury Homes for Sale in Tallahassee FL | Tallahassee Real Estate
oceans,,A 50 minute video giving us the reality of coral reef bleaching
oceans,,Watching the Great Barrier Reef die first hand. This is a short 2min film I shot over the past 3 years living on the Reef. We have lost over 50% of the coral in the past 2 years alone. The current state of this once beautiful location is seriously shocking
oceans,,Ocean News | Divers set a World Record
oceans,,Not so Crystal clear: Potential threat of cruise ship sewage spills inspires protests in Monterey Bay Marine Sanctuary
oceans,,Shadow Oak Realtor
oceans,,4K Tropical Beach - Relaxing Ocean...
oceans,,What were they doing?
oceans,,Other review from my younger bro. Ratac in Montenegro. Very open and friendly beach. :)
oceans,,Beautiful California Beaches and Waves at Newport Beach / Laguna Beach
oceans,,Hollywood Stunner
oceans,,Meanwhile in the Chukchi Sea...
oceans,,"X-post: My friend participated in the world's largest underwater cleanup this weekend. They removed an estimated 3,200 pounds of debris!"
oceans,[removed],How do I even pollute?
oceans,[removed],Nature’s Magic Ingredient - Water 26th July at 6:30pm at the British Library in London
oceans,"What if there was an opportunity for all of us with curious and inquisitive minds to learn about our oceans and be inspired by nature and all the progress we’ve made?

Ocean Planet Conference is the unique event bringing together top experts from across many ocean disciplines and making their world accessible to curious minds, to learn, to inspire, and to celebrate the ocean frontier.

[https://www.facebook.com/OceanPlanetFIE/videos/327342617933630/?t=482](https://www.facebook.com/OceanPlanetFIE/videos/327342617933630/?t=482)",2019 Ocean Planet Conference -​ October 18th &amp; 19th
oceans,,"Worlds Largest Beach Clean up - Record set in Deerfield Beach, FL Saturday, 6/15/19"
oceans,,"Worlds Largest Beach Clean up - Record set in Deerfield Beach, FL Saturday, 6/15/19"
oceans,,Over 4 Minutes of Dolphins at Sanibel Island / Captiva Island Florida
oceans,,The Ocean Cleanup is Preparing to Launch ‘System 001’ to Collect Trillions of Plastic Particles This Week
oceans,,Found this weird bone? on the beach. It's about 5 inches long and maybe 2 inches high at the tallest. It smells pretty bad too. Anybody know what it is?
oceans,,50 Minutes to Save the World
oceans,,Hi all! I am a photographer and filmmaker. I have always been fascinated by everything related oceans and marine animals. I recently started my YouTube channel that’s all about ocean conservation. Would love to hear your thoughts.
oceans,,Top 5 Biggest Waves Caught on Camera
oceans,"Hey All,

I Started watching plastic ocean on Netflix the opening beautiful blue  whale took my breath away but then you see all the nasty plastic just  floating on tthe top. I cried a lot feelings of such anger &amp;  disappointment washed over me. I don't understand how a intelligent  species such as ourselves can be so reckless &amp; selfish towards a  planet that gives us life. I highly recommend this doc if you haven't  seen it already. 

[Plastic Ocean](https://i.redd.it/xeyqe7i2gr431.jpg)",Plastic Ocean
oceans,,URGENT: President Trump plans to expand dangerous offshore drilling into nearly ALL U.S. waters – but you can help stop him.
oceans,,Meet the ocean cleanup company that's removed 4.7 million pounds of trash
oceans,,Ecuador gives US military permission to use Galapagos island as airfield
oceans,,Windy+Sunny Southern California Beach Day
oceans,[removed],"Water-soluble, compostable bags - safe, non-toxic, fully biodegradable. INDIEGOGO CAMPAIGN..."
oceans,,"PLEASE WATCH IF U HAVE 50 MINUTES THIS VIDEO IS ACTUALLY LIFE CHANGING, WE ARE ALL IN THIS TOGATHER LETS MAKE A CHANGE"
oceans,,Being Near The Ocean Changes Your Brain - OverBuZz WebSite
oceans,,A fleet of autonomous solar &amp; wind powered data harvesting boats will soon patrol our oceans monitoring for oil spills and illegal fishing vessels while constantly recording information like temperatures/currents
oceans,,A spooOky look at Death and it's presence in the Ocean
oceans,,The end of the Arctic as we know it
oceans,,2019 Bottlenose Dolphin Unusual Mortality Event along the Northern Gulf of Mexico
oceans,,Terrible!
oceans,,Australia approves vast coal mine near Great Barrier Reef - Business
oceans,"Calling all runners and sea turtles lovers! This weekend Loggerhead Marinelife Center, a sea turtle rehabilitation center in Juno Beach, FL will be hosting their annual Run 4 The Sea in which all profits will go towards supporting their mission of sea turtle and ocean conservation! ANYONE, ANYWHERE can participate and still receive their very own custom finisher medal and t-shirt! Sign up before it is too late!

Run 4 The Sea signup &amp; info -&gt; [RUN 4 THE SEA](https://marinelife.org/run/)

Run 4 The Sea facebook -&gt;[RUN 4 THE SEA FACEBOOK](https://www.facebook.com/events/2186848841361387/)

https://i.redd.it/d2jliqxse5431.png

https://i.redd.it/xzidwrxse5431.jpg",Run &amp; Support Sea Turtle Conservation!
oceans,,"Floating 'Forests' Protecting Shores - New innovative, floating breakwater structure with windbreaker on top, to protect shorelines from wind &amp; wave damage from ocean storms"
oceans,,The Open Ocean Robotics Autonomous solar and wind powered boats aim to be first to cross the Pacific Ocean unmanned
oceans,,"Hello everybody! I'm a 2D animator who started making videos on extinct and extant marine animals. Here is my first animation project for the year, where I compare the Jurassic World Mosasaurus to the real Mosasaurus hoffmanni. Enjoy!"
oceans,"I’m currently in Hawaii on vacation and heading off to do some snorkeling tomorrow morning. In preparation for this, I need to buy some sunscreen but i’m not sure which ones are safe and which are harmful to coral reefs. If anyone has any information in this topic please let me know.",What are the ingredients in sunscreen that contribute to coral reef damage?
oceans,,Ambitious plans to rid our oceans of trillions of plastic particles
oceans,,Ocean Tribe launched by Huemankind. Best apparels for the Ocean! ❤️🌊🐳🐬🦈🐙🐢 www.huemankind.world
oceans,,"I always pick up plastic trash at our SoCal beaches. No more Mylar balloons either, always pulling them out of the water."
oceans,,Ocean Pollution Facts: Why Our Oceans Need Your Help?
oceans,,Ocean Tribe - Because The Ocean Needs You
oceans,,Un Océan de Combats
oceans,,"Electrician Mandurah, Perth &amp;amp; Rockingham | Electrical,Solar &amp;amp; Air"
oceans,[removed],Shallowest under water mountain/seamount/guyot in international waters
oceans,,Orange Beach
oceans,,Happy Sunday!
oceans,,Brighton and nobody here &lt;3
oceans,,What is this thing? Thank you!!
oceans,,Human Lives Are Not More Important Than Animal Lives
oceans,,Dana point Salt creek drone video
oceans,,Happy World Oceans Day! #8June
oceans,,Happy World Oceans Day!
oceans,,One more picture-The white dolphin.
oceans,,One more picture-The white dolphin.
oceans,,Blue Bonds: An Audacious Plan to Save the World’s Oceans
oceans,,"Hi r/Oceans! After working for long hours, I just opened a store selling Ocean related Jewelry. Check it out if you'd like! =)"
oceans,,Did The Ocean Cleanup Project Fail?
oceans,,World Oceans Day 8th June
oceans,,"Happy World Oceans Day!!! Celebrate and honor the ocean, which connects us all."
oceans,,World Ocean Day 2019: More than 1 million birds and 100 thousand sea creatures dying every year due to marine pollution
oceans,,Hey! I found a website that sells ocean related jewelry that I really like. Can anyone share their experiences with this website?
oceans,,World Oceans Day: Paying attention to marine fisheries
